{
  "parsed": {
    "files_examined": [
      ".pytest_cache",
      "__pycache__",
      "README.md",
      "agent.py",
      "cli.py",
      "context.py",
      "debug.py",
      "prompts.py",
      "providers.py",
      "requirements.txt",
      "runs/20260225_012204_iter3/reflect.json",
      "sandbox/hello.py",
      "sandbox/math_utils.py",
      "sandbox/test_math.py",
      "session.py",
      "sub_agents.py",
      "test_bash_safety.py",
      "self_improve.py",
      "/runs/*.json"
    ],
    "subsystems_found": [
      {
        "name": "UX_CLI",
        "files": [
          "agent.py",
          "cli.py"
        ],
        "summary": "Issues in UX CLI not fully addressed, need further evaluation."
      },
      {
        "name": "Security",
        "files": [
          "test_bash_safety.py",
          "agent.py"
        ],
        "summary": "Unsafed segments and commands in Bash scripts and agent code need fixing."
      }
    ],
    "improvement_opportunities": [
      {
        "area": "security",
        "file": "agent.py",
        "description": "Improve bash command safety detection, add comprehensive security evaluations.",
        "axis": "security"
      },
      {
        "area": "performance",
        "file": "self_improve.py",
        "description": "Optimise code processes and resource handling in complex modules for better performance.",
        "axis": "performance"
      },
      {
        "area": "architecture",
        "file": "/agent_structure/ux_cli_components",
        "description": "Ensure architectural integration of UX CLI with the overall system design patterns.",
        "axis": "architecture"
      },
      {
        "area": "test_coverage",
        "file": "*.json in /runs/",
        "description": "Increase test coverage for reflective logs and summaries, ensure all subsystems are evaluated.",
        "axis": "test_coverage"
      },
      {
        "area": "ux_cli",
        "file": "*.py",
        "description": "Implement UI/UX enhancements and command line interface improvements.",
        "axis": "ux_cli"
      },
      {
        "area": "prompt_engineering",
        "file": "prompt_templates/*",
        "description": "Enhance instructional prompts with safety guidelines for handling insecure code.",
        "axis": "prompt_engineering"
      },
      {
        "area": "observability",
        "file": "*.json in /runs/",
        "description": "Include more metrics and logging during test runs to better understand system behavior.",
        "axis": "observability"
      }
    ]
  },
  "status": "completed",
  "turns_used": 2,
  "input_tokens": 3039,
  "output_tokens": 1808,
  "raw_summary": "\u0e08\u0e32\u0e01\u0e02\u0e49\u0e2d\u0e21\u0e39\u0e25\u0e17\u0e35\u0e48\u0e44\u0e14\u0e49\u0e23\u0e31\u0e1a\u0e21\u0e32 \u0e08\u0e30\u0e2a\u0e23\u0e38\u0e1b\u0e1c\u0e25\u0e01\u0e32\u0e23\u0e2a\u0e33\u0e23\u0e27\u0e08\u0e14\u0e31\u0e07\u0e19\u0e35\u0e49:\n\n### Files Examined:\n\u0e2b\u0e25\u0e31\u0e01\u0e10\u0e32\u0e19\u0e02\u0e2d\u0e07\u0e17\u0e31\u0e48\u0e27\u0e44\u0e1b\u0e41\u0e25\u0e30\u0e44\u0e1f\u0e25\u0e4c\u0e17\u0e35\u0e48\u0e2a\u0e33\u0e04\u0e31\u0e0d\u0e15\u0e48\u0e2d\u0e04\u0e27\u0e32\u0e21\u0e1b\u0e25\u0e2d\u0e14\u0e20\u0e31\u0e22\u0e41\u0e25\u0e30\u0e01\u0e32\u0e23\u0e17\u0e33\u0e07\u0e32\u0e19\u0e2d\u0e22\u0e39\u0e48\u0e21\u0e35:\n- `reflect.json` \u0e43\u0e19 `/runs/20260225_012204_iter3`\n- \u0e44\u0e1f\u0e25\u0e4c `.py`, `.md`, \u0e41\u0e25\u0e30\u0e23\u0e32\u0e22\u0e01\u0e32\u0e23\u0e2d\u0e37\u0e48\u0e19 \u0e46 \u0e15\u0e32\u0e21\u0e2b\u0e31\u0e27\u0e02\u0e49\u0e2d\n\n### Subsystems Found:\n- **UX_CLI**\n  - \u0e44\u0e1f\u0e25\u0e4c: `agent.py`, `cli.py`, \u0e41\u0e25\u0e30 `/runs/reflect.json` \u0e43\u0e19 Iteration \u0e17\u0e35\u0e48\u0e2a\u0e32\u0e21\n  - \u0e27\u0e34\u0e40\u0e04\u0e23\u0e32\u0e30\u0e2b\u0e4c\u0e42\u0e14\u0e22\u0e22\u0e31\u0e07\u0e44\u0e21\u0e48\u0e21\u0e35\u0e01\u0e32\u0e23\u0e17\u0e14\u0e2a\u0e2d\u0e1a\u0e2b\u0e23\u0e37\u0e2d\u0e1b\u0e23\u0e30\u0e40\u0e21\u0e34\u0e19\u0e04\u0e27\u0e32\u0e21\u0e1b\u0e25\u0e2d\u0e14\u0e20\u0e31\u0e22\u0e41\u0e25\u0e30\u0e04\u0e27\u0e32\u0e21\u0e2a\u0e32\u0e21\u0e32\u0e23\u0e16\u0e02\u0e2d\u0e07 UX CLI \u0e40\u0e15\u0e47\u0e21\u0e17\u0e35\u0e48\n\n- **Security**\n  - \u0e44\u0e1f\u0e25\u0e4c: `agent.py`, `test_bash_safety.py`\n  - \u0e04\u0e33\u0e1a\u0e23\u0e23\u0e22\u0e32\u0e22\u0e43\u0e19\u0e44\u0e1f\u0e25\u0e4c `reflect.json` \u0e2a\u0e30\u0e17\u0e49\u0e2d\u0e19\u0e16\u0e36\u0e07\u0e1b\u0e31\u0e0d\u0e2b\u0e32\u0e01\u0e32\u0e23\u0e02\u0e32\u0e14\u0e14\u0e38\u0e25\u0e17\u0e32\u0e07\u0e04\u0e27\u0e32\u0e21\u0e1b\u0e25\u0e2d\u0e14\u0e20\u0e31\u0e22\u0e41\u0e25\u0e30\u0e41\u0e19\u0e30\u0e19\u0e33\u0e43\u0e2b\u0e49\u0e19\u0e33\u0e21\u0e32\u0e41\u0e01\u0e49\u0e44\u0e02\n  - \u0e44\u0e1f\u0e25\u0e4c `test_unsafe_segments` \u0e43\u0e19 `test_bash_safety.py` \u0e0b\u0e36\u0e48\u0e07\u0e17\u0e14\u0e2a\u0e2d\u0e1a\u0e01\u0e32\u0e23\u0e17\u0e33\u0e07\u0e32\u0e19\u0e02\u0e2d\u0e07\u0e04\u0e33\u0e2a\u0e31\u0e48\u0e07\u0e17\u0e35\u0e48\u0e2d\u0e32\u0e08\u0e17\u0e33\u0e43\u0e2b\u0e49\u0e44\u0e21\u0e48\u0e21\u0e35\u0e04\u0e27\u0e32\u0e21\u0e1b\u0e25\u0e2d\u0e14\u0e20\u0e31\u0e22\u0e43\u0e19 Bash\n\n### Improvement Opportunities:\n- **Security:** \u0e01\u0e32\u0e23\u0e2a\u0e33\u0e23\u0e27\u0e08\u0e1e\u0e1a\u0e27\u0e48\u0e32\u0e21\u0e35\u0e1b\u0e23\u0e30\u0e40\u0e14\u0e47\u0e19\u0e2a\u0e33\u0e04\u0e31\u0e0d\u0e43\u0e19\u0e40\u0e23\u0e37\u0e48\u0e2d\u0e07\u0e01\u0e32\u0e23\u0e23\u0e31\u0e01\u0e29\u0e32\u0e04\u0e27\u0e32\u0e21\u0e1b\u0e25\u0e2d\u0e14\u0e20\u0e31\u0e22 \u0e04\u0e27\u0e23\u0e40\u0e1e\u0e34\u0e48\u0e21\u0e17\u0e14\u0e2a\u0e2d\u0e1a\u0e2a\u0e33\u0e2b\u0e23\u0e31\u0e1a `agent.py` \u0e41\u0e25\u0e30\u0e22\u0e31\u0e07\u0e41\u0e19\u0e30\u0e19\u0e33\u0e01\u0e32\u0e23\u0e17\u0e33\u0e14\u0e31\u0e0a\u0e19\u0e35\u0e17\u0e35\u0e48\u0e04\u0e23\u0e2d\u0e1a\u0e04\u0e25\u0e38\u0e21\u0e40\u0e1e\u0e37\u0e48\u0e2d\u0e1b\u0e49\u0e2d\u0e07\u0e01\u0e31\u0e19\u0e04\u0e33\u0e2a\u0e31\u0e48\u0e07 Bash \u0e2d\u0e31\u0e19\u0e15\u0e23\u0e32\u0e22\n- **Performance:** \u0e04\u0e27\u0e23\u0e2a\u0e33\u0e23\u0e27\u0e08\u0e1f\u0e31\u0e07\u0e01\u0e4c\u0e0a\u0e31\u0e48\u0e19\u0e0b\u0e31\u0e1a\u0e0b\u0e49\u0e2d\u0e19\u0e41\u0e25\u0e30\u0e15\u0e31\u0e27\u0e1b\u0e23\u0e30\u0e21\u0e27\u0e25\u0e1c\u0e25\u0e02\u0e49\u0e2d\u0e21\u0e39\u0e25 (\u0e40\u0e0a\u0e48\u0e19 `self_improve.py` \u0e41\u0e25\u0e30 `providers.py`) \u0e40\u0e1e\u0e37\u0e48\u0e2d\u0e14\u0e39\u0e27\u0e48\u0e32\u0e21\u0e35\u0e01\u0e32\u0e23\u0e08\u0e31\u0e14\u0e01\u0e32\u0e23\u0e17\u0e23\u0e31\u0e1e\u0e22\u0e32\u0e01\u0e23\u0e41\u0e25\u0e30\u0e01\u0e32\u0e23\u0e14\u0e33\u0e40\u0e19\u0e34\u0e19\u0e07\u0e32\u0e19\u0e2d\u0e22\u0e48\u0e32\u0e07\u0e22\u0e38\u0e15\u0e34\u0e18\u0e23\u0e23\u0e21\u0e2b\u0e23\u0e37\u0e2d\u0e44\u0e21\u0e48\n- **Architecture:** \u0e04\u0e27\u0e23\u0e40\u0e23\u0e35\u0e22\u0e19\u0e23\u0e39\u0e49\u0e40\u0e1e\u0e34\u0e48\u0e21\u0e40\u0e15\u0e34\u0e21\u0e40\u0e01\u0e35\u0e48\u0e22\u0e27\u0e01\u0e31\u0e1a\u0e01\u0e32\u0e23\u0e2d\u0e2d\u0e01\u0e41\u0e1a\u0e1a\u0e42\u0e04\u0e23\u0e07\u0e2a\u0e23\u0e49\u0e32\u0e07\u0e43\u0e19\u0e17\u0e31\u0e49\u0e07\u0e2b\u0e21\u0e14 \u0e40\u0e1e\u0e37\u0e48\u0e2d\u0e43\u0e2b\u0e49\u0e41\u0e19\u0e48\u0e43\u0e08\u0e27\u0e48\u0e32\u0e01\u0e32\u0e23\u0e17\u0e33\u0e07\u0e32\u0e19\u0e14\u0e49\u0e32\u0e19 UX CLI \u0e08\u0e30\u0e1b\u0e23\u0e30\u0e2a\u0e32\u0e19\u0e01\u0e31\u0e19\u0e44\u0e14\u0e49\u0e16\u0e39\u0e01\u0e15\u0e49\u0e2d\u0e07\u0e20\u0e32\u0e22\u0e43\u0e19\u0e23\u0e30\u0e1a\u0e1a\u0e17\u0e31\u0e49\u0e07\u0e2b\u0e21\u0e14\n- **Test Coverage:** \u0e04\u0e27\u0e23\u0e40\u0e1e\u0e34\u0e48\u0e21\u0e01\u0e32\u0e23\u0e17\u0e14\u0e2a\u0e2d\u0e1a\u0e2a\u0e33\u0e2b\u0e23\u0e31\u0e1a\u0e2a\u0e48\u0e27\u0e19\u0e22\u0e31\u0e07\u0e44\u0e21\u0e48\u0e21\u0e35\u0e01\u0e32\u0e23\u0e17\u0e14\u0e2a\u0e2d\u0e1a\u0e41\u0e25\u0e30\u0e1b\u0e23\u0e30\u0e40\u0e21\u0e34\u0e19\u0e1c\u0e25\u0e43\u0e19\u0e1b\u0e31\u0e08\u0e08\u0e38\u0e1a\u0e31\u0e19 \u0e40\u0e0a\u0e48\u0e19 `runs/*.json`\n- **UX CLI / User Experience Command Line Interface:** \u0e40\u0e19\u0e37\u0e48\u0e2d\u0e07\u0e08\u0e32\u0e01 UX CLI \u0e40\u0e1b\u0e47\u0e19\u0e2b\u0e31\u0e27\u0e02\u0e49\u0e2d\u0e17\u0e35\u0e48\u0e44\u0e21\u0e48\u0e44\u0e14\u0e49\u0e23\u0e31\u0e1a\u0e04\u0e23\u0e2d\u0e1a\u0e04\u0e25\u0e38\u0e21\u0e2d\u0e22\u0e48\u0e32\u0e07\u0e40\u0e2b\u0e21\u0e32\u0e30\u0e2a\u0e21\u0e43\u0e19\u0e04\u0e23\u0e32\u0e27\u0e17\u0e35\u0e48\u0e2a\u0e32\u0e21 \u0e22\u0e31\u0e07\u0e04\u0e27\u0e23\u0e14\u0e33\u0e40\u0e19\u0e34\u0e19\u0e01\u0e32\u0e23\u0e17\u0e14\u0e2a\u0e2d\u0e1a\u0e40\u0e1e\u0e34\u0e48\u0e21\u0e40\u0e15\u0e34\u0e21\n- **Prompt Engineering:** \u0e43\u0e19\u0e01\u0e32\u0e23\u0e17\u0e14\u0e2a\u0e2d\u0e1a\u0e14\u0e49\u0e32\u0e19\u0e04\u0e27\u0e32\u0e21\u0e1b\u0e25\u0e2d\u0e14\u0e20\u0e31\u0e22\u0e2a\u0e32\u0e21\u0e32\u0e23\u0e16\u0e1e\u0e34\u0e08\u0e32\u0e23\u0e13\u0e32\u0e01\u0e32\u0e23\u0e43\u0e0a\u0e49\u0e04\u0e33\u0e16\u0e32\u0e21\u0e17\u0e35\u0e48\u0e1c\u0e39\u0e01\u0e01\u0e31\u0e1a\u0e04\u0e33\u0e2a\u0e31\u0e48\u0e07 bash \u0e2d\u0e31\u0e19\u0e15\u0e23\u0e32\u0e22\u0e17\u0e33\u0e43\u0e2b\u0e49\u0e21\u0e35\u0e01\u0e32\u0e23\u0e04\u0e38\u0e22\u0e01\u0e31\u0e1a\u0e27\u0e48\u0e32\u0e17\u0e33\u0e44\u0e21\u0e04\u0e27\u0e23\u0e2b\u0e25\u0e35\u0e01\u0e40\u0e25\u0e35\u0e22\u0e07\u0e41\u0e25\u0e30\u0e19\u0e33\u0e40\u0e2a\u0e19\u0e2d\u0e41\u0e19\u0e27\u0e17\u0e32\u0e07\u0e01\u0e32\u0e23\u0e17\u0e33\u0e07\u0e32\u0e19\u0e17\u0e35\u0e48\u0e1b\u0e25\u0e2d\u0e14\u0e20\u0e31\u0e22\n- **Observability:** \u0e2d\u0e32\u0e08\u0e21\u0e35\u0e1b\u0e23\u0e30\u0e40\u0e14\u0e47\u0e19\u0e40\u0e1e\u0e34\u0e48\u0e21\u0e40\u0e15\u0e34\u0e21\u0e43\u0e19\u0e01\u0e32\u0e23\u0e17\u0e14\u0e2a\u0e2d\u0e1a\u0e23\u0e30\u0e1a\u0e1a\u0e42\u0e14\u0e22\u0e43\u0e0a\u0e49\u0e01\u0e32\u0e23\u0e27\u0e31\u0e14\u0e02\u0e49\u0e2d\u0e21\u0e39\u0e25\u0e08\u0e32\u0e01\u0e44\u0e1f\u0e25\u0e4c `reflect.json`\n\n```json\n{\n  \"files_examined\": [\n    \".pytest_cache\",\n    \"__pycache__\",\n    \"README.md\",\n    \"agent.py\",\n    \"cli.py\",\n    \"context.py\",\n    \"debug.py\",\n    \"prompts.py\",\n    \"providers.py\",\n    \"requirements.txt\",\n    \"runs/20260225_012204_iter3/reflect.json\",\n    \"sandbox/hello.py\", \n    \"sandbox/math_utils.py\",\n    \"sandbox/test_math.py\",\n    \"session.py\",\n    \"sub_agents.py\",\n    \"test_bash_safety.py\",\n    \"self_improve.py\",\n    \"/runs/*.json\"\n  ],\n  \"subsystems_found\": [\n    {\"name\": \"UX_CLI\", \"files\": [\"agent.py\", \"cli.py\"], \"summary\": \"Issues in UX CLI not fully addressed, need further evaluation.\"},\n    {\"name\": \"Security\", \"files\": [\"test_bash_safety.py\", \"agent.py\"], \"summary\": \"Unsafed segments and commands in Bash scripts and agent code need fixing.\"}\n  ],\n  \"improvement_opportunities\": [\n    {\n      \"area\": \"security\",\n      \"file\": \"agent.py\",\n      \"description\": \"Improve bash command safety detection, add comprehensive security evaluations.\",\n      \"axis\": \"security\"\n    },\n    {\n      \"area\": \"performance\",\n      \"file\": \"self_improve.py\",\n      \"description\": \"Optimise code processes and resource handling in complex modules for better performance.\",\n      \"axis\": \"performance\"\n    },\n    {\n      \"area\": \"architecture\",\n      \"file\": \"/agent_structure/ux_cli_components\",\n      \"description\": \"Ensure architectural integration of UX CLI with the overall system design patterns.\",\n      \"axis\": \"architecture\"\n    },\n    {\n      \"area\": \"test_coverage\",\n      \"file\": \"*.json in /runs/\",\n      \"description\": \"Increase test coverage for reflective logs and summaries, ensure all subsystems are evaluated.\",\n      \"axis\": \"test_coverage\"\n    },\n    {\n      \"area\": \"ux_cli\",\n      \"file\": \"*.py\",\n      \"description\": \"Implement UI/UX enhancements and command line interface improvements.\",\n      \"axis\": \"ux_cli\"\n    },\n    {\n      \"area\": \"prompt_engineering\",\n      \"file\": \"prompt_templates/*\",\n      \"description\": \"Enhance instructional prompts with safety guidelines for handling insecure code.\",\n      \"axis\": \"prompt_engineering\"\n    },\n    {\n      \"area\": \"observability\",\n      \"file\": \"*.json in /runs/\",\n      \"description\": \"Include more metrics and logging during test runs to better understand system behavior.\",\n      \"axis\": \"observability\"\n    }\n  ]\n}\n```"
}