{
  "parsed": {
    "files_examined": [
      "runs/20260225_003123_iter1/explore.json",
      "agent.py",
      "runs/benchmark_writeup.md"
    ],
    "subsystems_found": [
      {
        "name": "tests_and_benchmarks",
        "files": [
          "test_coder_subagent.py",
          "tools.py"
        ],
        "summary": "\u0e42\u0e1f\u0e25\u0e40\u0e14\u0e2d\u0e23\u0e4c\u0e41\u0e25\u0e30\u0e44\u0e1f\u0e25\u0e4c\u0e17\u0e35\u0e48\u0e40\u0e01\u0e35\u0e48\u0e22\u0e27\u0e02\u0e49\u0e2d\u0e07\u0e01\u0e31\u0e1a\u0e01\u0e32\u0e23\u0e17\u0e14\u0e2a\u0e2d\u0e1a\u0e41\u0e25\u0e30\u0e01\u0e32\u0e23\u0e1b\u0e23\u0e34\u0e21\u0e32\u0e13\u0e07\u0e32\u0e19\u0e02\u0e2d\u0e07\u0e23\u0e30\u0e1a\u0e1a"
      },
      {
        "name": "runs_tracker",
        "files": [
          "runs/20260225_012204_iter3/iteration_summary.json",
          "runs/benchmark_writeup.md"
        ],
        "summary": "\u0e42\u0e1f\u0e25\u0e40\u0e14\u0e2d\u0e23\u0e4c\u0e41\u0e25\u0e30\u0e44\u0e1f\u0e25\u0e4c\u0e2a\u0e33\u0e2b\u0e23\u0e31\u0e1a\u0e01\u0e32\u0e23\u0e15\u0e34\u0e14\u0e15\u0e32\u0e21\u0e41\u0e25\u0e30\u0e40\u0e02\u0e35\u0e22\u0e19\u0e23\u0e32\u0e22\u0e07\u0e32\u0e19\u0e1c\u0e25\u0e02\u0e2d\u0e07\u0e01\u0e32\u0e23\u0e17\u0e14\u0e2a\u0e2d\u0e1a\u0e41\u0e25\u0e30\u0e01\u0e32\u0e23\u0e1b\u0e23\u0e34\u0e21\u0e32\u0e13\u0e07\u0e32\u0e19"
      },
      {
        "name": "utils",
        "files": [
          "sandbox/hello.py",
          "context.py"
        ],
        "summary": "\u0e44\u0e1f\u0e25\u0e4c\u0e17\u0e35\u0e48\u0e21\u0e35\u0e04\u0e27\u0e32\u0e21\u0e08\u0e33\u0e40\u0e1b\u0e47\u0e19\u0e43\u0e19\u0e01\u0e32\u0e23\u0e17\u0e33\u0e07\u0e32\u0e19\u0e2d\u0e31\u0e15\u0e42\u0e19\u0e21\u0e31\u0e15\u0e34 \u0e2b\u0e23\u0e37\u0e2d\u0e01\u0e32\u0e23\u0e1a\u0e23\u0e34\u0e1a\u0e17\u0e02\u0e2d\u0e07\u0e23\u0e30\u0e1a\u0e1a"
      }
    ],
    "improvement_opportunities": [
      {
        "area": "performance",
        "file": "test_lf/1mb_file.txt",
        "description": "\u0e2d\u0e32\u0e08\u0e43\u0e0a\u0e49\u0e40\u0e27\u0e25\u0e32\u0e43\u0e19\u0e01\u0e32\u0e23\u0e17\u0e14\u0e2a\u0e2d\u0e1a\u0e41\u0e25\u0e30\u0e2a\u0e48\u0e07\u0e1c\u0e25\u0e25\u0e31\u0e1e\u0e18\u0e4c\u0e17\u0e35\u0e48\u0e21\u0e32\u0e01\u0e01\u0e27\u0e48\u0e32\u0e1b\u0e01\u0e15\u0e34\u0e40\u0e19\u0e37\u0e48\u0e2d\u0e07\u0e08\u0e32\u0e01\u0e23\u0e39\u0e1b\u0e41\u0e1a\u0e1a\u0e02\u0e2d\u0e07\u0e44\u0e1f\u0e25\u0e4c\u0e21\u0e35\u0e02\u0e19\u0e32\u0e14\u0e43\u0e2b\u0e0d\u0e48",
        "axis": "performance"
      },
      {
        "area": "security",
        "file": "*",
        "description": "\u0e04\u0e27\u0e23\u0e08\u0e30\u0e15\u0e23\u0e27\u0e08\u0e2a\u0e2d\u0e1a\u0e01\u0e32\u0e23\u0e23\u0e31\u0e1a\u0e02\u0e49\u0e2d\u0e21\u0e39\u0e25\u0e23\u0e30\u0e2b\u0e27\u0e48\u0e32\u0e07\u0e1c\u0e39\u0e49\u0e43\u0e0a\u0e49\u0e41\u0e25\u0e30\u0e23\u0e30\u0e1a\u0e1a\u0e40\u0e1e\u0e37\u0e48\u0e2d\u0e1b\u0e49\u0e2d\u0e07\u0e01\u0e31\u0e19\u0e02\u0e49\u0e2d\u0e21\u0e39\u0e25\u0e17\u0e35\u0e48\u0e44\u0e21\u0e48\u0e2a\u0e2d\u0e14\u0e04\u0e25\u0e49\u0e2d\u0e07\u0e2b\u0e23\u0e37\u0e2d\u0e16\u0e39\u0e01\u0e41\u0e17\u0e23\u0e01\u0e41\u0e0b\u0e07",
        "axis": "security"
      },
      {
        "area": "test_coverage",
        "file": "*.py",
        "description": "\u0e04\u0e27\u0e23\u0e40\u0e1e\u0e34\u0e48\u0e21\u8986\u76d6\u7387\u6d4b\u8bd5\u4ee5\u786e\u4fdd\u6240\u6709\u4ee3\u7801\u8def\u5f84\u90fd\u5f97\u5230\u9a8c\u8bc1\u3002",
        "axis": "test_coverage"
      }
    ]
  },
  "status": "completed",
  "turns_used": 2,
  "input_tokens": 5346,
  "output_tokens": 1430,
  "raw_summary": "\u0e08\u0e32\u0e01\u0e01\u0e32\u0e23\u0e2a\u0e33\u0e23\u0e27\u0e08\u0e42\u0e04\u0e23\u0e07\u0e2a\u0e23\u0e49\u0e32\u0e07\u0e44\u0e1f\u0e25\u0e4c\u0e41\u0e25\u0e30\u0e27\u0e31\u0e0f\u0e08\u0e31\u0e01\u0e23\u0e1e\u0e31\u0e12\u0e19\u0e32 \u0e01\u0e47\u0e2a\u0e32\u0e21\u0e32\u0e23\u0e16\u0e17\u0e33\u0e04\u0e27\u0e32\u0e21\u0e40\u0e02\u0e49\u0e32\u0e43\u0e08\u0e40\u0e01\u0e35\u0e48\u0e22\u0e27\u0e01\u0e31\u0e1a\u0e42\u0e1f\u0e25\u0e40\u0e14\u0e2d\u0e23\u0e4c\u0e15\u0e48\u0e32\u0e07 \u0e46 \u0e41\u0e25\u0e30\u0e44\u0e1f\u0e25\u0e4c\u0e17\u0e35\u0e48\u0e01\u0e33\u0e25\u0e31\u0e07\u0e08\u0e30\u0e15\u0e23\u0e27\u0e08\u0e2a\u0e2d\u0e1a\u0e44\u0e14\u0e49\u0e14\u0e31\u0e07\u0e19\u0e35\u0e49:\n\n### \u0e23\u0e30\u0e1a\u0e1a\u0e2a\u0e33\u0e04\u0e31\u0e0d\u0e43\u0e19\u0e23\u0e2b\u0e31\u0e2a\u0e40\u0e1a\u0e2a:\n1. **\u0e42\u0e1f\u0e25\u0e40\u0e14\u0e2d\u0e23\u0e4c `runs`**: \n   - \u0e40\u0e1b\u0e47\u0e19\u0e42\u0e1f\u0e25\u0e40\u0e14\u0e2d\u0e23\u0e4c\u0e17\u0e35\u0e48\u0e43\u0e0a\u0e49\u0e40\u0e01\u0e47\u0e1a\u0e02\u0e49\u0e2d\u0e21\u0e39\u0e25\u0e1b\u0e23\u0e30\u0e27\u0e31\u0e15\u0e34\u0e02\u0e2d\u0e07\u0e01\u0e32\u0e23\u0e17\u0e14\u0e2a\u0e2d\u0e1a\u0e2b\u0e23\u0e37\u0e2d\u0e15\u0e23\u0e27\u0e08\u0e2a\u0e2d\u0e1a\u0e15\u0e32\u0e21\u0e23\u0e2d\u0e1a\u0e40\u0e27\u0e25\u0e32\u0e40\u0e23\u0e37\u0e48\u0e2d\u0e07 \u0e40\u0e0a\u0e48\u0e19 \u0e1c\u0e25\u0e01\u0e32\u0e23\u0e17\u0e33\u0e07\u0e32\u0e19\u0e2b\u0e23\u0e37\u0e2d\u0e01\u0e32\u0e23\u0e22\u0e49\u0e2d\u0e19\u0e01\u0e25\u0e31\u0e1a\n   - \u0e2a\u0e23\u0e38\u0e1b\u0e41\u0e25\u0e30\u0e2a\u0e30\u0e17\u0e49\u0e2d\u0e19\u0e16\u0e36\u0e07\u0e01\u0e23\u0e30\u0e1a\u0e27\u0e19\u0e01\u0e32\u0e23\u0e1e\u0e31\u0e12\u0e19\u0e32\u0e43\u0e19\u0e41\u0e15\u0e48\u0e25\u0e30\u0e04\u0e23\u0e31\u0e49\u0e07\n\n2. **\u0e42\u0e1f\u0e25\u0e40\u0e14\u0e2d\u0e23\u0e4c `sandbox`**: \n   - \u0e40\u0e1b\u0e47\u0e19\u0e42\u0e1f\u0e25\u0e40\u0e14\u0e2d\u0e23\u0e4c\u0e2a\u0e33\u0e2b\u0e23\u0e31\u0e1a\u0e17\u0e14\u0e25\u0e2d\u0e07\u0e42\u0e04\u0e49\u0e14\u0e2a\u0e48\u0e27\u0e19\u0e15\u0e48\u0e32\u0e07\u0e46, \u0e17\u0e33\u0e2b\u0e19\u0e49\u0e32\u0e17\u0e35\u0e48\u0e04\u0e25\u0e49\u0e32\u0e22 sandbox \u0e43\u0e19\u0e23\u0e30\u0e1a\u0e1a\u0e1b\u0e0f\u0e34\u0e1a\u0e31\u0e15\u0e34\u0e01\u0e32\u0e23 \u0e40\u0e0a\u0e48\u0e19 `hello.py`, `math_utils.py`\n\n3. **\u0e44\u0e1f\u0e25\u0e4c\u0e2b\u0e25\u0e31\u0e01:**\n   - `agent.py`: \u0e1c\u0e39\u0e49\u0e14\u0e39\u0e41\u0e25\u0e2a\u0e33\u0e04\u0e31\u0e0d\u0e2b\u0e23\u0e37\u0e2d\u0e40\u0e23\u0e35\u0e22\u0e01\u0e27\u0e48\u0e32\u0e1b\u0e32\u0e23\u0e4c\u0e17\u0e40\u0e19\u0e2d\u0e23\u0e4c\u0e43\u0e19\u0e42\u0e04\u0e23\u0e07\u0e01\u0e32\u0e23.\n   - `context.py`: \u0e01\u0e38\u0e21\u0e02\u0e49\u0e2d\u0e21\u0e39\u0e25\u0e17\u0e32\u0e07\u0e1a\u0e23\u0e34\u0e1a\u0e17\n   - `providers.py`: \u0e2d\u0e32\u0e08\u0e40\u0e01\u0e35\u0e48\u0e22\u0e27\u0e02\u0e49\u0e2d\u0e07\u0e01\u0e31\u0e1a\u0e01\u0e32\u0e23\u0e08\u0e31\u0e14\u0e40\u0e15\u0e23\u0e35\u0e22\u0e21\u0e41\u0e25\u0e30\u0e08\u0e31\u0e14\u0e01\u0e32\u0e23 API, \u0e2a\u0e33\u0e2b\u0e23\u0e31\u0e1a\u0e2a\u0e37\u0e48\u0e2d\u0e2a\u0e32\u0e23\u0e23\u0e48\u0e27\u0e21\u0e15\u0e48\u0e32\u0e07 \u0e46 \n   - `self_improve.py`: \u0e40\u0e04\u0e23\u0e37\u0e48\u0e2d\u0e07\u0e21\u0e37\u0e2d\u0e2b\u0e23\u0e37\u0e2d\u0e42\u0e21\u0e14\u0e39\u0e25\u0e17\u0e35\u0e48\u0e43\u0e0a\u0e49\u0e43\u0e19\u0e01\u0e32\u0e23\u0e1b\u0e23\u0e31\u0e1a\u0e1b\u0e23\u0e38\u0e07\u0e04\u0e27\u0e32\u0e21\u0e2a\u0e32\u0e21\u0e32\u0e23\u0e16\u0e02\u0e2d\u0e07\u0e23\u0e30\u0e1a\u0e1a\n\n### \u0e44\u0e1f\u0e25\u0e4c\u0e2a\u0e33\u0e04\u0e31\u0e0d\u0e43\u0e19\u0e42\u0e1f\u0e25\u0e40\u0e14\u0e2d\u0e23\u0e4c\u0e17\u0e14\u0e2a\u0e2d\u0e1a (`test_`)\n- \u0e21\u0e35\u0e01\u0e23\u0e30\u0e1a\u0e27\u0e19\u0e01\u0e32\u0e23\u0e15\u0e23\u0e27\u0e08\u0e2a\u0e2d\u0e1a\u0e2b\u0e25\u0e32\u0e22\u0e2d\u0e22\u0e48\u0e32\u0e07\u0e40\u0e0a\u0e48\u0e19:`test_bash_safety`, `test_debug`, `test_error_isolation` \u0e40\u0e1b\u0e47\u0e19\u0e15\u0e49\u0e19\n\n### \u0e42\u0e2d\u0e01\u0e32\u0e2a\u0e01\u0e32\u0e23\u0e1e\u0e31\u0e12\u0e19\u0e32:\n\n1. **\u0e04\u0e27\u0e32\u0e21\u0e1b\u0e25\u0e2d\u0e14\u0e20\u0e31\u0e22 (security)**: \u0e08\u0e30\u0e0a\u0e48\u0e27\u0e22\u0e43\u0e19\u0e01\u0e32\u0e23\u0e15\u0e23\u0e27\u0e08\u0e2a\u0e2d\u0e1a\u0e41\u0e25\u0e30\u0e21\u0e31\u0e48\u0e19\u0e43\u0e08\u0e27\u0e48\u0e32\u0e23\u0e30\u0e1a\u0e1a\u0e17\u0e38\u0e01\u0e20\u0e32\u0e04\u0e2a\u0e48\u0e27\u0e19\u0e40\u0e1b\u0e47\u0e19\u0e44\u0e1b\u0e42\u0e14\u0e22\u0e44\u0e21\u0e48\u0e21\u0e35\u0e02\u0e49\u0e2d\u0e1c\u0e34\u0e14\u0e1e\u0e25\u0e32\u0e14\u0e2b\u0e23\u0e37\u0e2d\u0e04\u0e27\u0e32\u0e21\u0e40\u0e2a\u0e35\u0e48\u0e22\u0e07\u0e17\u0e35\u0e48\u0e40\u0e01\u0e35\u0e48\u0e22\u0e27\u0e01\u0e31\u0e1a\u0e04\u0e27\u0e32\u0e21\u0e1b\u0e25\u0e2d\u0e14\u0e20\u0e31\u0e22\n2. **\u0e1b\u0e23\u0e30\u0e2a\u0e34\u0e17\u0e18\u0e20\u0e32\u0e1e (performance)**: \u0e08\u0e31\u0e14\u0e01\u0e32\u0e23\u0e01\u0e31\u0e1a\u0e01\u0e23\u0e30\u0e1a\u0e27\u0e19\u0e01\u0e32\u0e23\u0e17\u0e33\u0e07\u0e32\u0e19\u0e2b\u0e23\u0e37\u0e2d\u0e2d\u0e31\u0e25\u0e01\u0e2d\u0e23\u0e34\u0e17\u0e36\u0e21\u0e17\u0e35\u0e48\u0e2d\u0e32\u0e08\u0e43\u0e0a\u0e49\u0e40\u0e27\u0e25\u0e32\u0e41\u0e25\u0e30\u0e01\u0e32\u0e23\u0e1a\u0e31\u0e19\u0e17\u0e36\u0e01\u0e02\u0e49\u0e2d\u0e21\u0e39\u0e25\u0e21\u0e32\u0e01\u0e40\u0e01\u0e34\u0e19\u0e44\u0e1b \u0e40\u0e0a\u0e48\u0e19 `test_lf` \u0e44\u0e1f\u0e25\u0e4c\u0e17\u0e35\u0e48\u0e21\u0e35\u0e02\u0e19\u0e32\u0e14\u0e43\u0e2b\u0e0d\u0e48\n3. **\u0e2a\u0e16\u0e32\u0e1b\u0e31\u0e15\u0e22\u0e01\u0e23\u0e23\u0e21 (architecture)**: \u0e1e\u0e34\u0e08\u0e32\u0e23\u0e13\u0e32\u0e27\u0e48\u0e32\u0e40\u0e1b\u0e47\u0e19\u0e2a\u0e49\u0e19\u0e2a\u0e23\u0e49\u0e32\u0e07\u0e17\u0e35\u0e48\u0e41\u0e02\u0e47\u0e07\u0e41\u0e23\u0e07 \u0e41\u0e25\u0e30\u0e2a\u0e32\u0e21\u0e32\u0e23\u0e16\u0e1b\u0e23\u0e31\u0e1a\u0e43\u0e0a\u0e49\u0e01\u0e31\u0e1a\u0e42\u0e04\u0e23\u0e07\u0e01\u0e32\u0e23\u0e02\u0e49\u0e2d\u0e21\u0e39\u0e25\u0e41\u0e25\u0e30\u0e2b\u0e19\u0e48\u0e27\u0e22\u0e07\u0e32\u0e19\u0e44\u0e14\u0e49\u0e2d\u0e22\u0e48\u0e32\u0e07\u0e44\u0e23 \n4. **\u0e04\u0e27\u0e32\u0e21\u0e04\u0e23\u0e2d\u0e1a\u0e04\u0e25\u0e38\u0e21\u0e01\u0e32\u0e23\u0e17\u0e14\u0e2a\u0e2d\u0e1a (test_coverage)**: \u0e08\u0e30\u0e0a\u0e48\u0e27\u0e22\u0e27\u0e31\u0e14\u0e27\u0e48\u0e32\u0e23\u0e39\u0e1b\u0e41\u0e1a\u0e1a\u0e01\u0e32\u0e23\u0e17\u0e14\u0e2a\u0e2d\u0e1a\u0e21\u0e35\u0e04\u0e23\u0e2d\u0e1a\u0e04\u0e25\u0e38\u0e21\u0e21\u0e32\u0e01\u0e1e\u0e2d\u0e2b\u0e23\u0e37\u0e2d\u0e44\u0e21\u0e48\n\n### \u0e02\u0e31\u0e49\u0e19\u0e15\u0e2d\u0e19\u0e15\u0e48\u0e2d\u0e44\u0e1b:\n\u0e2a\u0e48\u0e07\u0e1c\u0e25\u0e25\u0e31\u0e1e\u0e18\u0e4c\u0e17\u0e35\u0e48\u0e17\u0e23\u0e32\u0e1a\u0e08\u0e32\u0e01\u0e44\u0e1f\u0e25\u0e4c\u0e2b\u0e25\u0e31\u0e01\u0e17\u0e35\u0e48\u0e2a\u0e33\u0e23\u0e27\u0e08 \u0e41\u0e25\u0e30\u0e04\u0e49\u0e19\u0e2b\u0e32\u0e42\u0e2d\u0e01\u0e32\u0e2a\u0e43\u0e19\u0e01\u0e32\u0e23\u0e1b\u0e23\u0e31\u0e1a\u0e1b\u0e23\u0e38\u0e07\u0e43\u0e19\u0e41\u0e15\u0e48\u0e25\u0e30\u0e20\u0e32\u0e04\u0e2a\u0e48\u0e27\u0e19\u0e15\u0e32\u0e21\u0e40\u0e01\u0e13\u0e11\u0e4c\u0e17\u0e35\u0e48\u0e15\u0e31\u0e49\u0e07\u0e44\u0e27\u0e49 \n\n```json\n{\n  \"files_examined\": [\n    \"runs/20260225_003123_iter1/explore.json\",\n    \"agent.py\",\n    \"runs/benchmark_writeup.md\"\n  ],\n  \"subsystems_found\": [\n    {\n      \"name\": \"tests_and_benchmarks\",\n      \"files\": [\"test_coder_subagent.py\", \"tools.py\"],\n      \"summary\": \"\u0e42\u0e1f\u0e25\u0e40\u0e14\u0e2d\u0e23\u0e4c\u0e41\u0e25\u0e30\u0e44\u0e1f\u0e25\u0e4c\u0e17\u0e35\u0e48\u0e40\u0e01\u0e35\u0e48\u0e22\u0e27\u0e02\u0e49\u0e2d\u0e07\u0e01\u0e31\u0e1a\u0e01\u0e32\u0e23\u0e17\u0e14\u0e2a\u0e2d\u0e1a\u0e41\u0e25\u0e30\u0e01\u0e32\u0e23\u0e1b\u0e23\u0e34\u0e21\u0e32\u0e13\u0e07\u0e32\u0e19\u0e02\u0e2d\u0e07\u0e23\u0e30\u0e1a\u0e1a\"\n    },\n    {\n      \"name\": \"runs_tracker\",\n      \"files\": [\n        \"runs/20260225_012204_iter3/iteration_summary.json\",\n        \"runs/benchmark_writeup.md\"\n      ],\n      \"summary\": \"\u0e42\u0e1f\u0e25\u0e40\u0e14\u0e2d\u0e23\u0e4c\u0e41\u0e25\u0e30\u0e44\u0e1f\u0e25\u0e4c\u0e2a\u0e33\u0e2b\u0e23\u0e31\u0e1a\u0e01\u0e32\u0e23\u0e15\u0e34\u0e14\u0e15\u0e32\u0e21\u0e41\u0e25\u0e30\u0e40\u0e02\u0e35\u0e22\u0e19\u0e23\u0e32\u0e22\u0e07\u0e32\u0e19\u0e1c\u0e25\u0e02\u0e2d\u0e07\u0e01\u0e32\u0e23\u0e17\u0e14\u0e2a\u0e2d\u0e1a\u0e41\u0e25\u0e30\u0e01\u0e32\u0e23\u0e1b\u0e23\u0e34\u0e21\u0e32\u0e13\u0e07\u0e32\u0e19\"\n    },\n    {\n      \"name\": \"utils\",\n      \"files\": [\"sandbox/hello.py\", \"context.py\"],\n      \"summary\": \"\u0e44\u0e1f\u0e25\u0e4c\u0e17\u0e35\u0e48\u0e21\u0e35\u0e04\u0e27\u0e32\u0e21\u0e08\u0e33\u0e40\u0e1b\u0e47\u0e19\u0e43\u0e19\u0e01\u0e32\u0e23\u0e17\u0e33\u0e07\u0e32\u0e19\u0e2d\u0e31\u0e15\u0e42\u0e19\u0e21\u0e31\u0e15\u0e34 \u0e2b\u0e23\u0e37\u0e2d\u0e01\u0e32\u0e23\u0e1a\u0e23\u0e34\u0e1a\u0e17\u0e02\u0e2d\u0e07\u0e23\u0e30\u0e1a\u0e1a\"\n    }\n  ],\n  \"improvement_opportunities\": [\n    {\n      \"area\": \"performance\",\n      \"file\": \"test_lf/1mb_file.txt\",\n      \"description\": \"\u0e2d\u0e32\u0e08\u0e43\u0e0a\u0e49\u0e40\u0e27\u0e25\u0e32\u0e43\u0e19\u0e01\u0e32\u0e23\u0e17\u0e14\u0e2a\u0e2d\u0e1a\u0e41\u0e25\u0e30\u0e2a\u0e48\u0e07\u0e1c\u0e25\u0e25\u0e31\u0e1e\u0e18\u0e4c\u0e17\u0e35\u0e48\u0e21\u0e32\u0e01\u0e01\u0e27\u0e48\u0e32\u0e1b\u0e01\u0e15\u0e34\u0e40\u0e19\u0e37\u0e48\u0e2d\u0e07\u0e08\u0e32\u0e01\u0e23\u0e39\u0e1b\u0e41\u0e1a\u0e1a\u0e02\u0e2d\u0e07\u0e44\u0e1f\u0e25\u0e4c\u0e21\u0e35\u0e02\u0e19\u0e32\u0e14\u0e43\u0e2b\u0e0d\u0e48\",\n      \"axis\": \"performance\"\n    },\n    {\n      \"area\": \"security\",\n      \"file\": \"*\",\n      \"description\": \"\u0e04\u0e27\u0e23\u0e08\u0e30\u0e15\u0e23\u0e27\u0e08\u0e2a\u0e2d\u0e1a\u0e01\u0e32\u0e23\u0e23\u0e31\u0e1a\u0e02\u0e49\u0e2d\u0e21\u0e39\u0e25\u0e23\u0e30\u0e2b\u0e27\u0e48\u0e32\u0e07\u0e1c\u0e39\u0e49\u0e43\u0e0a\u0e49\u0e41\u0e25\u0e30\u0e23\u0e30\u0e1a\u0e1a\u0e40\u0e1e\u0e37\u0e48\u0e2d\u0e1b\u0e49\u0e2d\u0e07\u0e01\u0e31\u0e19\u0e02\u0e49\u0e2d\u0e21\u0e39\u0e25\u0e17\u0e35\u0e48\u0e44\u0e21\u0e48\u0e2a\u0e2d\u0e14\u0e04\u0e25\u0e49\u0e2d\u0e07\u0e2b\u0e23\u0e37\u0e2d\u0e16\u0e39\u0e01\u0e41\u0e17\u0e23\u0e01\u0e41\u0e0b\u0e07\",\n      \"axis\": \"security\"\n    },\n    {\n      \"area\": \"test_coverage\",\n      \"file\": \"*.py\",\n      \"description\": \"\u0e04\u0e27\u0e23\u0e40\u0e1e\u0e34\u0e48\u0e21\u8986\u76d6\u7387\u6d4b\u8bd5\u4ee5\u786e\u4fdd\u6240\u6709\u4ee3\u7801\u8def\u5f84\u90fd\u5f97\u5230\u9a8c\u8bc1\u3002\",\n      \"axis\": \"test_coverage\"\n    }\n  ]\n}\n```"
}