{
  "parsed": {
    "hypotheses": [
      {
        "id": "H1",
        "title": "\u0e40\u0e1e\u0e34\u0e48\u0e21\u0e28\u0e31\u0e01\u0e22\u0e20\u0e32\u0e1e\u0e01\u0e32\u0e23\u0e17\u0e33\u0e07\u0e32\u0e19\u0e1e\u0e23\u0e49\u0e2d\u0e21 Caching",
        "axis": "performance",
        "description": "\u0e01\u0e32\u0e23\u0e1b\u0e23\u0e31\u0e1a\u0e1b\u0e23\u0e38\u0e07\u0e01\u0e32\u0e23\u0e17\u0e33\u0e07\u0e32\u0e19\u0e40\u0e1e\u0e37\u0e48\u0e2d\u0e0a\u0e48\u0e27\u0e22\u0e25\u0e14\u0e40\u0e27\u0e25\u0e32\u0e41\u0e25\u0e30\u0e04\u0e27\u0e32\u0e21\u0e40\u0e23\u0e47\u0e27\u0e43\u0e19\u0e01\u0e32\u0e23\u0e17\u0e33\u0e07\u0e32\u0e19\u0e14\u0e49\u0e27\u0e22\u0e01\u0e32\u0e23\u0e40\u0e01\u0e47\u0e1a\u0e02\u0e49\u0e2d\u0e21\u0e39\u0e25\u0e17\u0e35\u0e48\u0e08\u0e33\u0e40\u0e1b\u0e47\u0e19\u0e41\u0e25\u0e30\u0e43\u0e0a\u0e49\u0e07\u0e32\u0e19\u0e23\u0e48\u0e27\u0e21\u0e01\u0e31\u0e19",
        "files_to_change": [
          "*"
        ],
        "estimated_value": 9,
        "estimated_risk": 2,
        "net_score": 7
      },
      {
        "id": "H2",
        "title": "\u0e40\u0e1e\u0e34\u0e48\u0e21\u0e2d\u0e07\u0e04\u0e4c\u0e1b\u0e23\u0e30\u0e01\u0e2d\u0e1a Prompt Engineering",
        "axis": "prompt_engineering",
        "description": "\u0e01\u0e32\u0e23\u0e1b\u0e23\u0e31\u0e1a\u0e41\u0e25\u0e30\u0e41\u0e19\u0e30\u0e19\u0e33\u0e27\u0e34\u0e18\u0e35\u0e43\u0e0a\u0e49\u0e01\u0e32\u0e23\u0e2a\u0e37\u0e48\u0e2d\u0e2a\u0e32\u0e23\u0e14\u0e49\u0e32\u0e19\u0e20\u0e32\u0e29\u0e32\u0e1e\u0e39\u0e14\u0e43\u0e2b\u0e49\u0e01\u0e31\u0e1a\u0e1c\u0e39\u0e49\u0e43\u0e0a\u0e49\u0e27\u0e48\u0e32\u0e04\u0e27\u0e23\u0e17\u0e33\u0e2d\u0e22\u0e48\u0e32\u0e07\u0e44\u0e23\u0e01\u0e31\u0e1a\u0e04\u0e33\u0e2a\u0e31\u0e48\u0e07\u0e17\u0e32\u0e07 CLI",
        "files_to_change": [
          "*"
        ],
        "estimated_value": 7,
        "estimated_risk": 3,
        "net_score": 4
      },
      {
        "id": "H3",
        "title": "\u0e40\u0e1e\u0e34\u0e48\u0e21\u0e2d\u0e07\u0e04\u0e4c\u0e1b\u0e23\u0e30\u0e01\u0e2d\u0e1a Observability \u0e40\u0e0a\u0e34\u0e07\u0e02\u0e49\u0e2d\u0e21\u0e39\u0e25",
        "axis": "observability",
        "description": "\u0e01\u0e32\u0e23\u0e2a\u0e23\u0e49\u0e32\u0e07\u0e23\u0e30\u0e1a\u0e1a\u0e17\u0e35\u0e48\u0e23\u0e31\u0e1a\u0e04\u0e27\u0e32\u0e21\u0e08\u0e33\u0e40\u0e1b\u0e47\u0e19\u0e43\u0e19\u0e01\u0e32\u0e23\u0e15\u0e34\u0e14\u0e15\u0e32\u0e21\u0e41\u0e25\u0e30\u0e1b\u0e23\u0e30\u0e40\u0e21\u0e34\u0e19\u0e1b\u0e23\u0e30\u0e2a\u0e34\u0e17\u0e18\u0e34\u0e20\u0e32\u0e1e\u0e02\u0e2d\u0e07\u0e42\u0e1b\u0e23\u0e41\u0e01\u0e23\u0e21\u0e43\u0e19\u0e2a\u0e20\u0e32\u0e1e\u0e41\u0e27\u0e14\u0e25\u0e49\u0e2d\u0e21\u0e08\u0e23\u0e34\u0e07",
        "files_to_change": [
          "*"
        ],
        "estimated_value": 8,
        "estimated_risk": 3,
        "net_score": 5
      },
      {
        "id": "H4",
        "title": "\u0e40\u0e1e\u0e34\u0e48\u0e21\u0e2d\u0e07\u0e04\u0e4c\u0e1b\u0e23\u0e30\u0e01\u0e2d\u0e1a\u0e01\u0e32\u0e23\u0e1b\u0e23\u0e31\u0e1a\u0e1b\u0e23\u0e38\u0e07 UX CLI",
        "axis": "ux_cli",
        "description": "\u0e01\u0e32\u0e23\u0e1b\u0e23\u0e31\u0e1a\u0e1b\u0e23\u0e38\u0e07\u0e04\u0e33\u0e41\u0e19\u0e30\u0e19\u0e33\u0e41\u0e25\u0e30\u0e23\u0e32\u0e22\u0e25\u0e30\u0e40\u0e2d\u0e35\u0e22\u0e14\u0e04\u0e27\u0e32\u0e21\u0e0a\u0e48\u0e27\u0e22\u0e40\u0e2b\u0e25\u0e37\u0e2d\u0e04\u0e33\u0e2a\u0e31\u0e48\u0e07\u0e17\u0e32\u0e07 CLI \u0e43\u0e2b\u0e49\u0e1c\u0e39\u0e49\u0e43\u0e0a\u0e49\u0e2a\u0e32\u0e21\u0e32\u0e23\u0e16\u0e40\u0e02\u0e49\u0e32\u0e43\u0e08\u0e41\u0e25\u0e30\u0e43\u0e0a\u0e49\u0e07\u0e32\u0e19\u0e44\u0e14\u0e49\u0e2d\u0e22\u0e48\u0e32\u0e07\u0e21\u0e31\u0e48\u0e19\u0e43\u0e08\u0e21\u0e32\u0e01\u0e02\u0e36\u0e49\u0e19",
        "files_to_change": [
          "*"
        ],
        "estimated_value": 8,
        "estimated_risk": 2,
        "net_score": 6
      },
      {
        "id": "H5",
        "title": "\u0e40\u0e1e\u0e34\u0e48\u0e21\u0e04\u0e27\u0e32\u0e21\u0e04\u0e23\u0e2d\u0e1a\u0e04\u0e25\u0e38\u0e21\u0e43\u0e19\u0e01\u0e32\u0e23\u0e17\u0e14\u0e2a\u0e2d\u0e1a",
        "axis": "test_coverage",
        "description": "\u0e01\u0e32\u0e23\u0e40\u0e1b\u0e25\u0e35\u0e48\u0e22\u0e19\u0e08\u0e32\u0e01\u0e02\u0e31\u0e49\u0e19\u0e15\u0e2d\u0e19\u0e17\u0e14\u0e2a\u0e2d\u0e1a\u0e21\u0e32\u0e15\u0e23\u0e10\u0e32\u0e19\u0e43\u0e2b\u0e49\u0e04\u0e23\u0e2d\u0e1a\u0e04\u0e25\u0e38\u0e21\u0e17\u0e38\u0e01\u0e2a\u0e20\u0e32\u0e1e\u0e02\u0e2d\u0e07\u0e01\u0e32\u0e23\u0e14\u0e33\u0e40\u0e19\u0e34\u0e19\u0e07\u0e32\u0e19 \u0e1e\u0e23\u0e49\u0e2d\u0e21\u0e14\u0e49\u0e27\u0e22\u0e01\u0e32\u0e23\u0e17\u0e14\u0e2a\u0e2d\u0e1a\u0e01\u0e23\u0e13\u0e35\u0e02\u0e2d\u0e1a\u0e41\u0e25\u0e30\u0e01\u0e23\u0e13\u0e35\u0e41\u0e1a\u0e1a\u0e2a\u0e38\u0e48\u0e21",
        "files_to_change": [
          "*.py"
        ],
        "estimated_value": 7,
        "estimated_risk": 3,
        "net_score": 4
      }
    ],
    "selected": "H1",
    "rationale": "\u0e01\u0e32\u0e23\u0e1b\u0e23\u0e31\u0e1a\u0e1b\u0e23\u0e38\u0e07\u0e01\u0e32\u0e23\u0e17\u0e33\u0e07\u0e32\u0e19\u0e1e\u0e23\u0e49\u0e2d\u0e21\u0e23\u0e30\u0e1a\u0e1a Caching \u0e21\u0e35\u0e04\u0e48\u0e32\u0e43\u0e0a\u0e49\u0e08\u0e48\u0e32\u0e22\u0e40\u0e09\u0e25\u0e35\u0e48\u0e22\u0e17\u0e35\u0e48\u0e2a\u0e39\u0e07\u0e2a\u0e38\u0e14\u0e43\u0e19\u0e14\u0e49\u0e32\u0e19\u0e04\u0e27\u0e32\u0e21\u0e40\u0e1b\u0e47\u0e19\u0e44\u0e1b\u0e44\u0e14\u0e49 \u0e41\u0e25\u0e30\u0e04\u0e48\u0e32\u0e04\u0e27\u0e32\u0e21\u0e40\u0e2a\u0e35\u0e48\u0e22\u0e07\u0e17\u0e35\u0e48\u0e15\u0e48\u0e33 \u0e0b\u0e36\u0e48\u0e07\u0e2d\u0e32\u0e08\u0e0a\u0e48\u0e27\u0e22\u0e25\u0e14\u0e40\u0e27\u0e25\u0e32\u0e43\u0e19\u0e01\u0e32\u0e23\u0e14\u0e33\u0e40\u0e19\u0e34\u0e19\u0e07\u0e32\u0e19\u0e41\u0e25\u0e30\u0e17\u0e33\u0e43\u0e2b\u0e49\u0e1b\u0e23\u0e30\u0e2a\u0e34\u0e17\u0e18\u0e34\u0e20\u0e32\u0e1e\u0e01\u0e32\u0e23\u0e17\u0e33\u0e07\u0e32\u0e19\u0e40\u0e15\u0e47\u0e21\u0e04\u0e27\u0e32\u0e21\u0e2a\u0e32\u0e21\u0e32\u0e23\u0e16"
  },
  "status": "completed",
  "turns_used": 1,
  "input_tokens": 3211,
  "output_tokens": 1555,
  "raw_summary": "\u0e04\u0e13\u0e30\u0e01\u0e23\u0e23\u0e21\u0e01\u0e32\u0e23\u0e17\u0e33\u0e07\u0e32\u0e19\u0e2a\u0e32\u0e21\u0e32\u0e23\u0e16\u0e19\u0e33\u0e40\u0e2a\u0e19\u0e2d\u0e17\u0e24\u0e29\u0e0e\u0e35\u0e01\u0e32\u0e23\u0e1b\u0e23\u0e31\u0e1a\u0e1b\u0e23\u0e38\u0e07\u0e42\u0e04\u0e23\u0e07\u0e01\u0e32\u0e23\u0e08\u0e32\u0e01\u0e01\u0e32\u0e23\u0e04\u0e49\u0e19\u0e1e\u0e1a\u0e02\u0e2d\u0e07\u0e23\u0e30\u0e1a\u0e1a\u0e14\u0e31\u0e07\u0e15\u0e48\u0e2d\u0e44\u0e1b\u0e19\u0e35\u0e49:\n\n1. **\u0e40\u0e1e\u0e34\u0e48\u0e21\u0e1b\u0e23\u0e30\u0e2a\u0e34\u0e17\u0e18\u0e20\u0e32\u0e1e\u0e42\u0e14\u0e22\u0e43\u0e0a\u0e49\u0e07\u0e32\u0e19 Caching (Axis: Performance)**:\n   - \u0e04\u0e33\u0e2d\u0e18\u0e34\u0e1a\u0e32\u0e22: \u0e08\u0e32\u0e01\u0e41\u0e2b\u0e25\u0e48\u0e07\u0e02\u0e49\u0e2d\u0e21\u0e39\u0e25\u0e17\u0e14\u0e2a\u0e2d\u0e1a \u0e40\u0e0a\u0e48\u0e19 `test_lf/1mb_file.txt` \u0e40\u0e27\u0e25\u0e32\u0e43\u0e19\u0e01\u0e32\u0e23\u0e14\u0e33\u0e40\u0e19\u0e34\u0e19\u0e07\u0e32\u0e19\u0e2d\u0e32\u0e08\u0e2a\u0e32\u0e21\u0e32\u0e23\u0e16\u0e25\u0e14\u0e25\u0e07\u0e44\u0e14\u0e49\u0e14\u0e49\u0e27\u0e22\u0e01\u0e32\u0e23\u0e40\u0e1e\u0e34\u0e48\u0e21\u0e04\u0e27\u0e32\u0e21\u0e2a\u0e32\u0e21\u0e32\u0e23\u0e16\u0e43\u0e19\u0e01\u0e32\u0e23\u0e08\u0e31\u0e14\u0e40\u0e01\u0e47\u0e1a\u0e02\u0e49\u0e2d\u0e21\u0e39\u0e25\u0e17\u0e35\u0e48\u0e16\u0e39\u0e01\u0e15\u0e49\u0e2d\u0e07\u0e15\u0e32\u0e21\u0e04\u0e48\u0e32\u0e43\u0e0a\u0e49\u0e08\u0e48\u0e32\u0e22\u0e02\u0e2d\u0e07\u0e23\u0e30\u0e1a\u0e1a\u0e43\u0e19\u0e2d\u0e19\u0e32\u0e04\u0e15\n   - \u0e28\u0e31\u0e01\u0e22\u0e20\u0e32\u0e1e: 9 (\u0e01\u0e32\u0e23\u0e17\u0e33\u0e07\u0e32\u0e19\u0e42\u0e14\u0e22\u0e1c\u0e48\u0e32\u0e19\u0e01\u0e32\u0e23\u0e1b\u0e23\u0e30\u0e21\u0e27\u0e25\u0e1c\u0e25\u0e41\u0e1a\u0e1a\u0e40\u0e23\u0e35\u0e22\u0e01\u0e0b\u0e49\u0e33\u0e2d\u0e32\u0e08\u0e17\u0e33\u0e43\u0e2b\u0e49\u0e1b\u0e23\u0e30\u0e2a\u0e34\u0e17\u0e18\u0e34\u0e20\u0e32\u0e1e\u0e01\u0e32\u0e23\u0e17\u0e33\u0e07\u0e32\u0e19\u0e40\u0e1e\u0e34\u0e48\u0e21)\n   - \u0e04\u0e27\u0e32\u0e21\u0e40\u0e2a\u0e35\u0e48\u0e22\u0e07: 2 (\u0e01\u0e32\u0e23\u0e2a\u0e23\u0e49\u0e32\u0e07\u0e41\u0e25\u0e30\u0e08\u0e31\u0e14\u0e01\u0e32\u0e23\u0e2a\u0e37\u0e48\u0e2d\u0e40\u0e01\u0e47\u0e1a\u0e02\u0e49\u0e2d\u0e21\u0e39\u0e25\u0e2d\u0e32\u0e08\u0e15\u0e49\u0e2d\u0e07\u0e43\u0e0a\u0e49\u0e2d\u0e33\u0e19\u0e27\u0e22\u0e32\u0e23\u0e30\u0e1a\u0e1a\u0e43\u0e2b\u0e21\u0e48)\n\n2. **\u0e40\u0e1e\u0e34\u0e48\u0e21\u0e17\u0e31\u0e01\u0e29\u0e30\u0e1c\u0e39\u0e49\u0e43\u0e0a\u0e49\u0e14\u0e49\u0e27\u0e22\u0e01\u0e32\u0e23\u0e1b\u0e23\u0e31\u0e1a\u0e1b\u0e23\u0e38\u0e07\u0e04\u0e33\u0e41\u0e19\u0e30\u0e19\u0e33\u0e42\u0e14\u0e22\u0e25\u0e30\u0e40\u0e2d\u0e35\u0e22\u0e14\u0e40\u0e0a\u0e34\u0e07\u0e1b\u0e23\u0e30\u0e2a\u0e1a\u0e01\u0e32\u0e23\u0e13\u0e4c (Axis: UX CLI)**:\n   - \u0e04\u0e33\u0e2d\u0e18\u0e34\u0e1a\u0e32\u0e22: \u0e40\u0e1e\u0e37\u0e48\u0e2d\u0e43\u0e2b\u0e49\u0e02\u0e49\u0e2d\u0e21\u0e39\u0e25\u0e17\u0e35\u0e48\u0e0a\u0e31\u0e14\u0e40\u0e08\u0e19\u0e22\u0e34\u0e48\u0e07\u0e02\u0e36\u0e49\u0e19\u0e41\u0e01\u0e48\u0e19\u0e31\u0e01\u0e1e\u0e31\u0e12\u0e19\u0e32 \u0e08\u0e30\u0e40\u0e1e\u0e34\u0e48\u0e21\u0e04\u0e33\u0e01\u0e23\u0e30\u0e15\u0e38\u0e49\u0e19\u0e41\u0e25\u0e30\u0e27\u0e34\u0e18\u0e35\u0e43\u0e0a\u0e49\u0e43\u0e19\u0e04\u0e33\u0e41\u0e19\u0e30\u0e19\u0e33\u0e04\u0e33\u0e2a\u0e31\u0e48\u0e07 CLI\n   - \u0e28\u0e31\u0e01\u0e22\u0e20\u0e32\u0e1e: 8 (\u0e01\u0e32\u0e23\u0e1b\u0e23\u0e31\u0e1a\u0e1b\u0e23\u0e38\u0e07\u0e0a\u0e48\u0e27\u0e22\u0e43\u0e2b\u0e49\u0e19\u0e31\u0e01\u0e1e\u0e31\u0e12\u0e19\u0e32\u0e22\u0e34\u0e07\u0e23\u0e39\u0e49\u0e41\u0e25\u0e30\u0e40\u0e02\u0e49\u0e32\u0e43\u0e08\u0e02\u0e49\u0e2d\u0e21\u0e39\u0e25\u0e14\u0e49\u0e32\u0e19\u0e25\u0e48\u0e32\u0e07)\n   - \u0e04\u0e27\u0e32\u0e21\u0e40\u0e2a\u0e35\u0e48\u0e22\u0e07: 2 (\u0e2d\u0e32\u0e08\u0e23\u0e1a\u0e01\u0e27\u0e19\u0e07\u0e32\u0e19\u0e02\u0e2d\u0e07\u0e1c\u0e39\u0e49\u0e17\u0e35\u0e48\u0e21\u0e35\u0e1b\u0e23\u0e30\u0e2a\u0e1a\u0e01\u0e32\u0e23\u0e13\u0e4c\u0e21\u0e32\u0e01)\n\n3. **\u0e40\u0e1e\u0e34\u0e48\u0e21\u0e23\u0e30\u0e1a\u0e1a Prompt Engineering (Axis: Prompt Engineering)**:\n   - \u0e04\u0e33\u0e2d\u0e18\u0e34\u0e1a\u0e32\u0e22: \u0e40\u0e1e\u0e37\u0e48\u0e2d\u0e43\u0e2b\u0e49\u0e23\u0e30\u0e1a\u0e1a\u0e2a\u0e19\u0e31\u0e1a\u0e2a\u0e19\u0e38\u0e19\u0e01\u0e32\u0e23\u0e17\u0e33\u0e07\u0e32\u0e19\u0e43\u0e19\u0e01\u0e32\u0e23\u0e15\u0e2d\u0e1a\u0e2a\u0e19\u0e2d\u0e07\u0e04\u0e27\u0e32\u0e21\u0e15\u0e49\u0e2d\u0e07\u0e01\u0e32\u0e23\u0e17\u0e32\u0e07\u0e20\u0e32\u0e29\u0e32\u0e1e\u0e39\u0e14 \u0e40\u0e0a\u0e48\u0e19 \u0e01\u0e32\u0e23\u0e23\u0e30\u0e1a\u0e38\u0e02\u0e49\u0e2d\u0e21\u0e39\u0e25\u0e17\u0e35\u0e48\u0e08\u0e33\u0e40\u0e1b\u0e47\u0e19\u0e41\u0e25\u0e30\u0e2a\u0e23\u0e49\u0e32\u0e07 prompt \u0e2d\u0e22\u0e48\u0e32\u0e07\u0e21\u0e35\u0e1b\u0e23\u0e30\u0e2a\u0e34\u0e17\u0e18\u0e34\u0e20\u0e32\u0e1e\n   - \u0e28\u0e31\u0e01\u0e22\u0e20\u0e32\u0e1e: 7 (\u0e40\u0e1e\u0e34\u0e48\u0e21\u0e04\u0e27\u0e32\u0e21\u0e2a\u0e32\u0e21\u0e32\u0e23\u0e16\u0e43\u0e19\u0e01\u0e32\u0e23\u0e17\u0e33\u0e07\u0e32\u0e19\u0e40\u0e1e\u0e37\u0e48\u0e2d\u0e01\u0e32\u0e23\u0e2a\u0e37\u0e48\u0e2d\u0e2a\u0e32\u0e23\u0e01\u0e31\u0e1a\u0e1c\u0e39\u0e49\u0e43\u0e0a\u0e49\u0e43\u0e19\u0e25\u0e31\u0e01\u0e29\u0e13\u0e30\u0e19\u0e35\u0e49)\n   - \u0e04\u0e27\u0e32\u0e21\u0e40\u0e2a\u0e35\u0e48\u0e22\u0e07: 3 (\u0e2d\u0e32\u0e08\u0e08\u0e33\u0e40\u0e1b\u0e47\u0e19\u0e15\u0e49\u0e2d\u0e07\u0e1b\u0e23\u0e31\u0e1a\u0e41\u0e15\u0e48\u0e07\u0e23\u0e30\u0e1a\u0e1a\u0e43\u0e2b\u0e21\u0e48\u0e41\u0e25\u0e30\u0e17\u0e14\u0e25\u0e2d\u0e07\u0e43\u0e0a\u0e49\u0e07\u0e32\u0e19\u0e2d\u0e22\u0e48\u0e32\u0e07\u0e25\u0e30\u0e40\u0e2d\u0e35\u0e22\u0e14)\n\n4. **\u0e40\u0e1e\u0e34\u0e48\u0e21\u0e2d\u0e07\u0e04\u0e4c\u0e1b\u0e23\u0e30\u0e01\u0e2d\u0e1a Observability \u0e40\u0e0a\u0e34\u0e07\u0e02\u0e49\u0e2d\u0e21\u0e39\u0e25 (Axis: Observability)**:\n   - \u0e04\u0e33\u0e2d\u0e18\u0e34\u0e1a\u0e32\u0e22: \u0e40\u0e1e\u0e37\u0e48\u0e2d\u0e1b\u0e23\u0e31\u0e1a\u0e1b\u0e23\u0e38\u0e07\u0e04\u0e27\u0e32\u0e21\u0e23\u0e39\u0e49\u0e17\u0e32\u0e07\u0e01\u0e32\u0e23\u0e17\u0e33\u0e07\u0e32\u0e19\u0e20\u0e32\u0e22\u0e43\u0e19\u0e23\u0e30\u0e1a\u0e1a\u0e17\u0e35\u0e48\u0e08\u0e33\u0e40\u0e1b\u0e47\u0e19 \u0e42\u0e14\u0e22\u0e40\u0e1e\u0e34\u0e48\u0e21 log, metrics \u0e41\u0e25\u0e30 tracer \n   - \u0e28\u0e31\u0e01\u0e22\u0e20\u0e32\u0e1e: 8 (\u0e0a\u0e48\u0e27\u0e22\u0e43\u0e2b\u0e49\u0e40\u0e23\u0e32\u0e2a\u0e32\u0e21\u0e32\u0e23\u0e16\u0e21\u0e2d\u0e07\u0e40\u0e2b\u0e47\u0e19\u0e41\u0e25\u0e30\u0e1b\u0e23\u0e30\u0e40\u0e21\u0e34\u0e19\u0e1b\u0e23\u0e30\u0e2a\u0e34\u0e17\u0e18\u0e34\u0e20\u0e32\u0e1e\u0e02\u0e2d\u0e07\u0e42\u0e1b\u0e23\u0e41\u0e01\u0e23\u0e21\u0e43\u0e19\u0e2a\u0e20\u0e32\u0e1e\u0e41\u0e27\u0e14\u0e25\u0e49\u0e2d\u0e21\u0e17\u0e35\u0e48\u0e40\u0e01\u0e34\u0e14\u0e02\u0e36\u0e49\u0e19\u0e08\u0e23\u0e34\u0e07)\n   - \u0e04\u0e27\u0e32\u0e21\u0e40\u0e2a\u0e35\u0e48\u0e22\u0e07: 3 (\u0e01\u0e32\u0e23\u0e40\u0e1e\u0e34\u0e48\u0e21\u0e1f\u0e31\u0e07\u0e01\u0e4c\u0e0a\u0e31\u0e19\u0e43\u0e2b\u0e21\u0e48\u0e19\u0e35\u0e49\u0e2d\u0e32\u0e08\u0e23\u0e1a\u0e01\u0e27\u0e19\u0e01\u0e32\u0e23\u0e17\u0e33\u0e07\u0e32\u0e19\u0e1b\u0e01\u0e15\u0e34)\n\n5. **\u0e2a\u0e23\u0e49\u0e32\u0e07\u0e17\u0e14\u0e2a\u0e2d\u0e1a\u0e04\u0e23\u0e2d\u0e1a\u0e04\u0e25\u0e38\u0e21\u0e17\u0e31\u0e49\u0e07\u0e2b\u0e21\u0e14 (Axis: Test Coverage)**:\n   - \u0e04\u0e33\u0e2d\u0e18\u0e34\u0e1a\u0e32\u0e22: \u0e40\u0e1e\u0e34\u0e48\u0e21\u0e04\u0e27\u0e32\u0e21\u0e41\u0e19\u0e48\u0e19\u0e2d\u0e19\u0e43\u0e19\u0e01\u0e32\u0e23\u0e17\u0e14\u0e2a\u0e2d\u0e1a\u0e42\u0e1b\u0e23\u0e41\u0e01\u0e23\u0e21\u0e2a\u0e48\u0e27\u0e19\u0e43\u0e2b\u0e0d\u0e48 \u0e1e\u0e23\u0e49\u0e2d\u0e21\u0e14\u0e49\u0e27\u0e22\u0e01\u0e32\u0e23\u0e17\u0e14\u0e2a\u0e2d\u0e1a edge cases \u0e41\u0e25\u0e30\u0e01\u0e32\u0e23\u0e17\u0e14\u0e2a\u0e2d\u0e1a\u0e41\u0e1a\u0e1a\u0e2a\u0e38\u0e48\u0e21\n   - \u0e28\u0e31\u0e01\u0e22\u0e20\u0e32\u0e1e: 7 (\u0e0a\u0e48\u0e27\u0e22\u0e43\u0e2b\u0e49\u0e1a\u0e23\u0e34\u0e29\u0e31\u0e17\u0e40\u0e0a\u0e37\u0e48\u0e2d\u0e21\u0e31\u0e48\u0e19\u0e43\u0e19\u0e01\u0e23\u0e30\u0e1a\u0e27\u0e19\u0e01\u0e32\u0e23\u0e15\u0e23\u0e27\u0e08\u0e2a\u0e2d\u0e1a\u0e41\u0e25\u0e30\u0e1e\u0e31\u0e12\u0e19\u0e32)\n   - \u0e04\u0e27\u0e32\u0e21\u0e40\u0e2a\u0e35\u0e48\u0e22\u0e07: 3 (\u0e40\u0e1e\u0e34\u0e48\u0e21\u0e20\u0e32\u0e23\u0e30\u0e43\u0e19\u0e01\u0e32\u0e23\u0e17\u0e14\u0e2a\u0e2d\u0e1a\u0e02\u0e2d\u0e07\u0e0a\u0e38\u0e14\u0e42\u0e1b\u0e23\u0e41\u0e01\u0e23\u0e21)\n\n\u0e01\u0e32\u0e23\u0e40\u0e25\u0e37\u0e2d\u0e01\u0e17\u0e24\u0e29\u0e0e\u0e35\u0e14\u0e31\u0e07\u0e01\u0e25\u0e48\u0e32\u0e27\u0e42\u0e14\u0e22\u0e43\u0e0a\u0e49\u0e19\u0e31\u0e1a\u0e04\u0e30\u0e41\u0e19\u0e19\u0e1b\u0e23\u0e30\u0e2a\u0e34\u0e17\u0e18\u0e34\u0e20\u0e32\u0e1e:\n\n```json\n{\n  \"hypotheses\": [\n    {\n      \"id\": \"H1\",\n      \"title\": \"\u0e40\u0e1e\u0e34\u0e48\u0e21\u0e28\u0e31\u0e01\u0e22\u0e20\u0e32\u0e1e\u0e01\u0e32\u0e23\u0e17\u0e33\u0e07\u0e32\u0e19\u0e1e\u0e23\u0e49\u0e2d\u0e21 Caching\",\n      \"axis\": \"performance\",\n      \"description\": \"\u0e01\u0e32\u0e23\u0e1b\u0e23\u0e31\u0e1a\u0e1b\u0e23\u0e38\u0e07\u0e01\u0e32\u0e23\u0e17\u0e33\u0e07\u0e32\u0e19\u0e40\u0e1e\u0e37\u0e48\u0e2d\u0e0a\u0e48\u0e27\u0e22\u0e25\u0e14\u0e40\u0e27\u0e25\u0e32\u0e41\u0e25\u0e30\u0e04\u0e27\u0e32\u0e21\u0e40\u0e23\u0e47\u0e27\u0e43\u0e19\u0e01\u0e32\u0e23\u0e17\u0e33\u0e07\u0e32\u0e19\u0e14\u0e49\u0e27\u0e22\u0e01\u0e32\u0e23\u0e40\u0e01\u0e47\u0e1a\u0e02\u0e49\u0e2d\u0e21\u0e39\u0e25\u0e17\u0e35\u0e48\u0e08\u0e33\u0e40\u0e1b\u0e47\u0e19\u0e41\u0e25\u0e30\u0e43\u0e0a\u0e49\u0e07\u0e32\u0e19\u0e23\u0e48\u0e27\u0e21\u0e01\u0e31\u0e19\",\n      \"files_to_change\": [\"*\"],\n      \"estimated_value\": 9,\n      \"estimated_risk\": 2,\n      \"net_score\": 7\n    },\n    {\n      \"id\": \"H2\",\n      \"title\": \"\u0e40\u0e1e\u0e34\u0e48\u0e21\u0e2d\u0e07\u0e04\u0e4c\u0e1b\u0e23\u0e30\u0e01\u0e2d\u0e1a Prompt Engineering\",\n      \"axis\": \"prompt_engineering\",\n      \"description\": \"\u0e01\u0e32\u0e23\u0e1b\u0e23\u0e31\u0e1a\u0e41\u0e25\u0e30\u0e41\u0e19\u0e30\u0e19\u0e33\u0e27\u0e34\u0e18\u0e35\u0e43\u0e0a\u0e49\u0e01\u0e32\u0e23\u0e2a\u0e37\u0e48\u0e2d\u0e2a\u0e32\u0e23\u0e14\u0e49\u0e32\u0e19\u0e20\u0e32\u0e29\u0e32\u0e1e\u0e39\u0e14\u0e43\u0e2b\u0e49\u0e01\u0e31\u0e1a\u0e1c\u0e39\u0e49\u0e43\u0e0a\u0e49\u0e27\u0e48\u0e32\u0e04\u0e27\u0e23\u0e17\u0e33\u0e2d\u0e22\u0e48\u0e32\u0e07\u0e44\u0e23\u0e01\u0e31\u0e1a\u0e04\u0e33\u0e2a\u0e31\u0e48\u0e07\u0e17\u0e32\u0e07 CLI\",\n      \"files_to_change\": [\"*\"],\n      \"estimated_value\": 7,\n      \"estimated_risk\": 3,\n      \"net_score\": 4\n    },\n    {\n      \"id\": \"H3\",\n      \"title\": \"\u0e40\u0e1e\u0e34\u0e48\u0e21\u0e2d\u0e07\u0e04\u0e4c\u0e1b\u0e23\u0e30\u0e01\u0e2d\u0e1a Observability \u0e40\u0e0a\u0e34\u0e07\u0e02\u0e49\u0e2d\u0e21\u0e39\u0e25\",\n      \"axis\": \"observability\",\n      \"description\": \"\u0e01\u0e32\u0e23\u0e2a\u0e23\u0e49\u0e32\u0e07\u0e23\u0e30\u0e1a\u0e1a\u0e17\u0e35\u0e48\u0e23\u0e31\u0e1a\u0e04\u0e27\u0e32\u0e21\u0e08\u0e33\u0e40\u0e1b\u0e47\u0e19\u0e43\u0e19\u0e01\u0e32\u0e23\u0e15\u0e34\u0e14\u0e15\u0e32\u0e21\u0e41\u0e25\u0e30\u0e1b\u0e23\u0e30\u0e40\u0e21\u0e34\u0e19\u0e1b\u0e23\u0e30\u0e2a\u0e34\u0e17\u0e18\u0e34\u0e20\u0e32\u0e1e\u0e02\u0e2d\u0e07\u0e42\u0e1b\u0e23\u0e41\u0e01\u0e23\u0e21\u0e43\u0e19\u0e2a\u0e20\u0e32\u0e1e\u0e41\u0e27\u0e14\u0e25\u0e49\u0e2d\u0e21\u0e08\u0e23\u0e34\u0e07\",\n      \"files_to_change\": [\"*\"],\n      \"estimated_value\": 8,\n      \"estimated_risk\": 3,\n      \"net_score\": 5\n    },\n    {\n      \"id\": \"H4\",\n      \"title\": \"\u0e40\u0e1e\u0e34\u0e48\u0e21\u0e2d\u0e07\u0e04\u0e4c\u0e1b\u0e23\u0e30\u0e01\u0e2d\u0e1a\u0e01\u0e32\u0e23\u0e1b\u0e23\u0e31\u0e1a\u0e1b\u0e23\u0e38\u0e07 UX CLI\",\n      \"axis\": \"ux_cli\",\n      \"description\": \"\u0e01\u0e32\u0e23\u0e1b\u0e23\u0e31\u0e1a\u0e1b\u0e23\u0e38\u0e07\u0e04\u0e33\u0e41\u0e19\u0e30\u0e19\u0e33\u0e41\u0e25\u0e30\u0e23\u0e32\u0e22\u0e25\u0e30\u0e40\u0e2d\u0e35\u0e22\u0e14\u0e04\u0e27\u0e32\u0e21\u0e0a\u0e48\u0e27\u0e22\u0e40\u0e2b\u0e25\u0e37\u0e2d\u0e04\u0e33\u0e2a\u0e31\u0e48\u0e07\u0e17\u0e32\u0e07 CLI \u0e43\u0e2b\u0e49\u0e1c\u0e39\u0e49\u0e43\u0e0a\u0e49\u0e2a\u0e32\u0e21\u0e32\u0e23\u0e16\u0e40\u0e02\u0e49\u0e32\u0e43\u0e08\u0e41\u0e25\u0e30\u0e43\u0e0a\u0e49\u0e07\u0e32\u0e19\u0e44\u0e14\u0e49\u0e2d\u0e22\u0e48\u0e32\u0e07\u0e21\u0e31\u0e48\u0e19\u0e43\u0e08\u0e21\u0e32\u0e01\u0e02\u0e36\u0e49\u0e19\",\n      \"files_to_change\": [\"*\"],\n      \"estimated_value\": 8,\n      \"estimated_risk\": 2,\n      \"net_score\": 6\n    },\n    {\n      \"id\": \"H5\",\n      \"title\": \"\u0e40\u0e1e\u0e34\u0e48\u0e21\u0e04\u0e27\u0e32\u0e21\u0e04\u0e23\u0e2d\u0e1a\u0e04\u0e25\u0e38\u0e21\u0e43\u0e19\u0e01\u0e32\u0e23\u0e17\u0e14\u0e2a\u0e2d\u0e1a\",\n      \"axis\": \"test_coverage\",\n      \"description\": \"\u0e01\u0e32\u0e23\u0e40\u0e1b\u0e25\u0e35\u0e48\u0e22\u0e19\u0e08\u0e32\u0e01\u0e02\u0e31\u0e49\u0e19\u0e15\u0e2d\u0e19\u0e17\u0e14\u0e2a\u0e2d\u0e1a\u0e21\u0e32\u0e15\u0e23\u0e10\u0e32\u0e19\u0e43\u0e2b\u0e49\u0e04\u0e23\u0e2d\u0e1a\u0e04\u0e25\u0e38\u0e21\u0e17\u0e38\u0e01\u0e2a\u0e20\u0e32\u0e1e\u0e02\u0e2d\u0e07\u0e01\u0e32\u0e23\u0e14\u0e33\u0e40\u0e19\u0e34\u0e19\u0e07\u0e32\u0e19 \u0e1e\u0e23\u0e49\u0e2d\u0e21\u0e14\u0e49\u0e27\u0e22\u0e01\u0e32\u0e23\u0e17\u0e14\u0e2a\u0e2d\u0e1a\u0e01\u0e23\u0e13\u0e35\u0e02\u0e2d\u0e1a\u0e41\u0e25\u0e30\u0e01\u0e23\u0e13\u0e35\u0e41\u0e1a\u0e1a\u0e2a\u0e38\u0e48\u0e21\",\n      \"files_to_change\": [\"*.py\"],\n      \"estimated_value\": 7,\n      \"estimated_risk\": 3,\n      \"net_score\": 4\n    }\n  ],\n  \"selected\": \"H1\",\n  \"rationale\": \"\u0e01\u0e32\u0e23\u0e1b\u0e23\u0e31\u0e1a\u0e1b\u0e23\u0e38\u0e07\u0e01\u0e32\u0e23\u0e17\u0e33\u0e07\u0e32\u0e19\u0e1e\u0e23\u0e49\u0e2d\u0e21\u0e23\u0e30\u0e1a\u0e1a Caching \u0e21\u0e35\u0e04\u0e48\u0e32\u0e43\u0e0a\u0e49\u0e08\u0e48\u0e32\u0e22\u0e40\u0e09\u0e25\u0e35\u0e48\u0e22\u0e17\u0e35\u0e48\u0e2a\u0e39\u0e07\u0e2a\u0e38\u0e14\u0e43\u0e19\u0e14\u0e49\u0e32\u0e19\u0e04\u0e27\u0e32\u0e21\u0e40\u0e1b\u0e47\u0e19\u0e44\u0e1b\u0e44\u0e14\u0e49 \u0e41\u0e25\u0e30\u0e04\u0e48\u0e32\u0e04\u0e27\u0e32\u0e21\u0e40\u0e2a\u0e35\u0e48\u0e22\u0e07\u0e17\u0e35\u0e48\u0e15\u0e48\u0e33 \u0e0b\u0e36\u0e48\u0e07\u0e2d\u0e32\u0e08\u0e0a\u0e48\u0e27\u0e22\u0e25\u0e14\u0e40\u0e27\u0e25\u0e32\u0e43\u0e19\u0e01\u0e32\u0e23\u0e14\u0e33\u0e40\u0e19\u0e34\u0e19\u0e07\u0e32\u0e19\u0e41\u0e25\u0e30\u0e17\u0e33\u0e43\u0e2b\u0e49\u0e1b\u0e23\u0e30\u0e2a\u0e34\u0e17\u0e18\u0e34\u0e20\u0e32\u0e1e\u0e01\u0e32\u0e23\u0e17\u0e33\u0e07\u0e32\u0e19\u0e40\u0e15\u0e47\u0e21\u0e04\u0e27\u0e32\u0e21\u0e2a\u0e32\u0e21\u0e32\u0e23\u0e16\"\n}\n```"
}