{
  "parsed": {
    "files_examined": [
      "**/*.js",
      "**/*.css",
      "**/*.html",
      "**/*.json"
    ],
    "subsystems_found": [
      {
        "name": "JSON Configuration Files (if any)",
        "files": [],
        "summary": "No JSON configuration files found in the directory. No impact to examine."
      }
    ],
    "improvement_opportunities": [
      {
        "area": "Codebase Structure",
        "file": ".",
        "description": "In the absence of specific file types, improve codebase structure and add meaningful comments for better readability of existing files. Implement a consistent coding style guide.",
        "axis": "architecture"
      },
      {
        "area": "Documentation",
        "file": ".",
        "description": "Create a comprehensive README.md with setup instructions, dependencies, and contributions guidelines.",
        "axis": "ux_cli"
      },
      {
        "area": "Testing Frameworks",
        "file": "**/*test*.py (if any)",
        "description": "Add testing frameworks if necessary to improve test coverage. For Python projects that are not present it should be considered for future reference.",
        "axis": "test_coverage"
      }
    ]
  },
  "status": "completed",
  "turns_used": 6,
  "input_tokens": 6073,
  "output_tokens": 934,
  "raw_summary": "\u041a\u043e\u0434\u0431\u0435\u0439\u0437\u0434\u0435 \u043a\u0438\u0439\u0438\u043d\u043a\u0438 \u0432\u0430\u0440\u0438\u0430\u043d\u0442\u0442\u0430\u0440\u0433\u0430 \u043a\u0430\u0440\u0430\u0431\u0430\u0441\u0442\u0430\u043d \u0431\u0430\u0448\u043a\u0430 \u0444\u0430\u0439\u043b\u0434\u044b \u0442\u0430\u0431\u0443\u0443\u0433\u0430 \u0431\u043e\u043b\u0431\u043e\u0439\u0442. \u0411\u0443\u043b \u043a\u043e\u0434\u0431\u0435\u0439\u0437\u0434\u0435\u0433\u0438 \u043c\u04af\u043d\u0434\u0435\u043c\u0435\u043b\u0435\u0440\u0434\u0438 \u043e\u043f\u0442\u0438\u043c\u0430\u043b\u0434\u0443\u0443 \u0430\u0431\u0430\u043b\u0434\u0430 \u0442\u0435\u043a\u0448\u0435\u0440\u0441\u0435\u04a3\u0438\u0437, \u0431\u0438\u0440\u043e\u043a \u043c\u0430\u0441\u0441\u0443\u043b\u0443\u043a\u0442\u0443\u0443 \u0444\u0430\u0439\u043b\u0434\u0430\u0440 \u043c\u0435\u043d\u0435\u043d \u0430\u0439\u043b\u0430\u043d\u044b\u0448\u044b \u0442\u0443\u0443\u0440\u0430\u043b\u0443\u0443 \u0441\u0443\u043d\u0443\u0448\u0442\u0430\u0440 \u04e9\u0441\u04af\u0440\u0433\u04af\u043d \u0436\u0430\u0442\u0430\u0442.\n\n\u041a\u043e\u0434\u0431\u0435\u0439\u0437\u0434\u0438\u043d \u0434\u0438\u0440\u0435\u043a\u0442\u043e\u0440\u0438\u044f\u0441\u044b\u043d \u0447\u0435\u0447\u0438\u043f, \u0431\u0430\u0448\u043a\u0430 \u0444\u0430\u0439\u043b \u0444\u043e\u0440\u043c\u0430\u0442\u0442\u0430\u0440\u044b\u043d \u0438\u0437\u0438\u043b\u0434\u0435\u043f \u043a\u04e9\u0440\u04af\u043f \u0430\u0431\u0434\u0430\u043d \u0436\u0430\u0440\u0430\u0442\u043c\u044b\u0439 \u0431\u043e\u043b\u0441\u043e, \u043c\u0430\u0441\u0441\u0443\u043b\u0443\u043a\u0442\u0443\u0443 \u0441\u0442\u0440\u0443\u043a\u0442\u0443\u0440\u0430\u043b\u0430\u0440\u0434\u044b \u04e9\u0437\u0434\u04e9\u0448\u0442\u04af\u0440\u04af\u04af \u043a\u0435\u0440\u0435\u043a. \u041c\u044b\u043d\u0434\u0430\u0439 \u0442\u0430\u0442\u0430\u0430\u043b\u0434\u044b\u043a\u0442\u043e\u043e \u0434\u0430 \u043c\u0430\u0430\u043d\u0438\u0441\u0438 \u0431\u0430\u0440:\n\n```json\n{\n  \"files_examined\": [\"**/*.js\", \"**/*.css\", \"**/*.html\", \"**/*.json\"],\n  \"subsystems_found\": [\n    {\"name\": \"JSON Configuration Files (if any)\", \"files\": [], \"summary\": \"No JSON configuration files found in the directory. No impact to examine.\"}\n  ],\n  \"improvement_opportunities\": [\n    {\"area\": \"Codebase Structure\", \"file\": \".\", \"description\": \"In the absence of specific file types, improve codebase structure and add meaningful comments for better readability of existing files. Implement a consistent coding style guide.\", \"axis\": \"architecture\"},\n    {\"area\": \"Documentation\", \"file\": \".\", \"description\": \"Create a comprehensive README.md with setup instructions, dependencies, and contributions guidelines.\", \"axis\": \"ux_cli\"},\n    {\"area\": \"Testing Frameworks\", \"file\": \"**/*test*.py (if any)\", \"description\": \"Add testing frameworks if necessary to improve test coverage. For Python projects that are not present it should be considered for future reference.\", \"axis\": \"test_coverage\"}\n  ]\n}\n```"
}