{
  "parsed": {
    "files_examined": [
      ".git"
    ],
    "subsystems_found": [
      {
        "name": "Git Configuration",
        "files": [
          "config",
          "hooks/*"
        ],
        "summary": "Contains repository metadata, user info, and other configurations."
      }
    ],
    "improvement_opportunities": [
      {
        "area": "Secure Environment Variables Management",
        "file": ".git/config or any .github/workflows file if present.",
        "description": "Make sure no sensitive information is stored in plain text within repository configurations. Ensure CI/CD setups use encrypted secrets and avoid embedding environment variables directly into code or scripts.",
        "axis": "security"
      }
    ]
  },
  "status": "completed",
  "turns_used": 3,
  "input_tokens": 3401,
  "output_tokens": 882,
  "raw_summary": "Based on the tool response, there\u2019s no hidden `.vscode` folder present in the current working directory. However, we can still proceed with examining other folders that are typically sensitive or crucial for understanding security and test coverage setup.\n\n### Files Examined:\n\n- We examined the `.git/` directory, which contains version control-related files.\n  \n### Subsystems Found:\n\n1. **Git Configuration (`config`, `hooks`, etc.)**\n   - **Files**: `.git/config`\n   - **Summary**: The Git configuration file often contains repository metadata such as remote URLs, user information, and other configurations that could be sensitive if stored with plaintext credentials or accessed by unauthorized users.\n\n### Improvement Opportunities:\n\n1. **Secure Environment Variables Management**\n   - **Area**: Security\n   - **File/System Directory Involvement**:\n     - `.git/` (for checking if there are environment variables or secrets accidentally committed, especially in `repo/config`)\n     - Environment-specific configuration files under a root-level `/env` directory if present.\n     - CI/CD setup within `.github/workflows`, especially looking at how sensitive information is managed and referenced.\n   - **Description**: It's critical to ensure that no sensitive information like API keys or database passwords are stored in plain text, which would be evident during an exploration through the `.git/` folder. Additionally, configurations in CI files must strictly use encrypted secrets or vault systems rather than plaintext credentials.\n\n```json\n{\n  \"files_examined\": [\".git\"],\n  \"subsystems_found\": [\n    {\n      \"name\": \"Git Configuration\",\n      \"files\": [\"config\", \"hooks/*\"],\n      \"summary\": \"Contains repository metadata, user info, and other configurations.\"\n    }\n  ],\n  \"improvement_opportunities\": [\n    {\n      \"area\": \"Secure Environment Variables Management\",\n      \"file\": \".git/config or any .github/workflows file if present.\",\n      \"description\": \"Make sure no sensitive information is stored in plain text within repository configurations. Ensure CI/CD setups use encrypted secrets and avoid embedding environment variables directly into code or scripts.\",\n      \"axis\": \"security\"\n    }\n  ]\n}\n```"
}