{
  "parsed": {
    "hypotheses": [
      {
        "id": "H2",
        "title": "Implement CI/CD Test Coverage Tracking",
        "axis": "test_coverage",
        "description": "Introduce a reporting tool in CI/CD pipelines to track Python file test coverage.",
        "files_to_change": [
          "coverage.ini",
          ".github/workflows/python_tests.yml"
        ],
        "estimated_value": 7,
        "estimated_risk": 3,
        "net_score": 4
      },
      {
        "id": "H3",
        "title": "Add Command Line Progress Indicator",
        "axis": "ux_cli",
        "description": "Enhance script output for longer-running commands with progress indicators.",
        "files_to_change": [
          "hooks/*"
        ],
        "estimated_value": 6,
        "estimated_risk": 2,
        "net_score": 4
      },
      {
        "id": "H4",
        "title": "Enable Detailed Logging in CI/CD",
        "axis": "observability",
        "description": "Augment logging levels for debugging purposes within the build pipeline.",
        "files_to_change": [
          ".github/workflows/*.yml"
        ],
        "estimated_value": 5,
        "estimated_risk": 2,
        "net_score": 3
      }
    ],
    "selected": "H3",
    "rationale": "Adding a progress indicator to command line scripts (H3) addresses UX/UI concerns, offers end users valuable insights during lengthy tasks and improves interaction while being low-risk."
  },
  "status": "completed",
  "turns_used": 2,
  "input_tokens": 2358,
  "output_tokens": 831,
  "raw_summary": "Based on the lack of Python files or workflow configurations in the repository, here are three diverse hypotheses across different axes:\n\n```json\n{\n  \"hypotheses\": [\n    {\n      \"id\": \"H2\",\n      \"title\": \"Implement CI/CD Test Coverage Tracking\",\n      \"axis\": \"test_coverage\",\n      \"description\": \"Introduce a reporting tool in CI/CD pipelines to track Python file test coverage.\",\n      \"files_to_change\": [\"coverage.ini\", \".github/workflows/python_tests.yml\"],\n      \"estimated_value\": 7,\n      \"estimated_risk\": 3,\n      \"net_score\": 4\n    },\n    {\n      \"id\": \"H3\",\n      \"title\": \"Add Command Line Progress Indicator\",\n      \"axis\": \"ux_cli\",\n      \"description\": \"Enhance script output for longer-running commands with progress indicators.\",\n      \"files_to_change\": [\"hooks/*\"],\n      \"estimated_value\": 6,\n      \"estimated_risk\": 2,\n      \"net_score\": 4\n    },\n    {\n      \"id\": \"H4\",\n      \"title\": \"Enable Detailed Logging in CI/CD\",\n      \"axis\": \"observability\",\n      \"description\": \"Augment logging levels for debugging purposes within the build pipeline.\",\n      \"files_to_change\": [\".github/workflows/*.yml\"],\n      \"estimated_value\": 5,\n      \"estimated_risk\": 2,\n      \"net_score\": 3\n    }\n  ],\n  \"selected\": \"H3\",\n  \"rationale\": \"Adding a progress indicator to command line scripts (H3) addresses UX/UI concerns, offers end users valuable insights during lengthy tasks and improves interaction while being low-risk.\"\n}\n```"
}