{
  "parsed": {
    "hypotheses": [
      {
        "id": "H1",
        "title": "\u0e1b\u0e23\u0e31\u0e1a\u0e1b\u0e23\u0e38\u0e07\u0e04\u0e27\u0e32\u0e21\u0e0a\u0e31\u0e14\u0e40\u0e08\u0e19\u0e22\u0e01\u0e23\u0e30\u0e14\u0e31\u0e1a\u0e41\u0e25\u0e30\u0e40\u0e1e\u0e34\u0e48\u0e21\u0e01\u0e32\u0e23\u0e41\u0e08\u0e49\u0e07\u0e40\u0e15\u0e37\u0e2d\u0e19\u0e1c\u0e39\u0e49\u0e43\u0e0a\u0e49\u0e43\u0e19 'agent.py' and 'cli.py'",
        "axis": "ux_cli",
        "description": "\u0e40\u0e1e\u0e34\u0e48\u0e21\u0e23\u0e32\u0e22\u0e25\u0e30\u0e40\u0e2d\u0e35\u0e22\u0e14\u0e02\u0e49\u0e2d\u0e04\u0e27\u0e32\u0e21\u0e2a\u0e33\u0e2b\u0e23\u0e31\u0e1a\u0e04\u0e33\u0e2a\u0e31\u0e48\u0e07\u0e17\u0e35\u0e48\u0e2a\u0e33\u0e04\u0e31\u0e0d \u0e41\u0e25\u0e30\u0e1b\u0e23\u0e31\u0e1a\u0e1b\u0e23\u0e38\u0e07\u0e02\u0e49\u0e2d\u0e21\u0e39\u0e25\u0e17\u0e32\u0e07\u0e40\u0e17\u0e04\u0e19\u0e34\u0e04\u0e43\u0e2b\u0e49\u0e1e\u0e23\u0e49\u0e2d\u0e21\u0e21\u0e32\u0e01\u0e02\u0e36\u0e49\u0e19 \u0e2a\u0e23\u0e49\u0e32\u0e07\u0e23\u0e32\u0e22\u0e25\u0e30\u0e40\u0e2d\u0e35\u0e22\u0e14\u0e02\u0e49\u0e2d\u0e1c\u0e34\u0e14\u0e1e\u0e25\u0e32\u0e14\u0e17\u0e35\u0e48\u0e0a\u0e31\u0e14\u0e40\u0e08\u0e19\u0e41\u0e25\u0e30\u0e40\u0e02\u0e49\u0e32\u0e43\u0e08\u0e44\u0e14\u0e49\u0e07\u0e48\u0e32\u0e22",
        "files_to_change": [
          "agent.py",
          "cli.py"
        ],
        "estimated_value": 9,
        "estimated_risk": 2,
        "net_score": 7
      },
      {
        "id": "H2",
        "title": "\u0e1b\u0e23\u0e31\u0e1a\u0e1b\u0e23\u0e38\u0e07 prompt_engineering \u0e0b\u0e36\u0e48\u0e07\u0e2a\u0e32\u0e21\u0e32\u0e23\u0e16\u0e40\u0e1e\u0e34\u0e48\u0e21\u0e04\u0e27\u0e32\u0e21\u0e40\u0e02\u0e49\u0e32\u0e43\u0e08\u0e23\u0e30\u0e1a\u0e1a\u0e41\u0e25\u0e30\u0e1b\u0e23\u0e30\u0e2a\u0e1a\u0e01\u0e32\u0e23\u0e13\u0e4c\u0e43\u0e0a\u0e49\u0e07\u0e32\u0e19\u0e02\u0e2d\u0e07\u0e1c\u0e39\u0e49\u0e43\u0e0a\u0e49\u0e43\u0e19 'prompts.py'",
        "axis": "prompt_engineering",
        "description": "\u0e1b\u0e23\u0e31\u0e1a\u0e1b\u0e23\u0e38\u0e07 prompts \u0e40\u0e1e\u0e37\u0e48\u0e2d\u0e0a\u0e48\u0e27\u0e22\u0e40\u0e23\u0e35\u0e22\u0e01\u0e27\u0e48\u0e32\u0e40\u0e1b\u0e47\u0e19\u0e44\u0e1b\u0e2d\u0e22\u0e48\u0e32\u0e07\u0e16\u0e39\u0e01\u0e15\u0e49\u0e2d\u0e07 \u0e2a\u0e23\u0e49\u0e32\u0e07\u0e23\u0e32\u0e22\u0e25\u0e30\u0e40\u0e2d\u0e35\u0e22\u0e14\u0e17\u0e35\u0e48\u0e08\u0e30\u0e17\u0e33\u0e43\u0e2b\u0e49\u0e19\u0e31\u0e01\u0e1e\u0e31\u0e12\u0e19\u0e32\u0e40\u0e02\u0e49\u0e32\u0e43\u0e08\u0e23\u0e30\u0e1a\u0e1a\u0e41\u0e25\u0e30\u0e27\u0e34\u0e18\u0e35\u0e01\u0e32\u0e23\u0e17\u0e35\u0e48\u0e40\u0e2b\u0e21\u0e32\u0e30\u0e2a\u0e21\u0e43\u0e19\u0e01\u0e32\u0e23\u0e43\u0e0a\u0e49\u0e07\u0e32\u0e19;",
        "files_to_change": [
          "prompts.py"
        ],
        "estimated_value": 7,
        "estimated_risk": 1,
        "net_score": 6
      }
    ],
    "selected": "H1",
    "rationale": "\u0e2a\u0e21\u0e21\u0e15\u0e34\u0e10\u0e32\u0e19 H1 \u0e21\u0e35\u0e04\u0e27\u0e32\u0e21\u0e19\u0e48\u0e32\u0e08\u0e30\u0e40\u0e1b\u0e47\u0e19\u0e2a\u0e39\u0e07\u0e41\u0e25\u0e30\u0e2a\u0e23\u0e49\u0e32\u0e07\u0e04\u0e38\u0e13\u0e04\u0e48\u0e32\u0e17\u0e35\u0e48\u0e2a\u0e33\u0e04\u0e31\u0e0d\u0e21\u0e32\u0e01 \u0e41\u0e25\u0e30\u0e44\u0e21\u0e48\u0e21\u0e35\u0e04\u0e27\u0e32\u0e21\u0e40\u0e2a\u0e35\u0e48\u0e22\u0e07\u0e43\u0e19\u0e01\u0e32\u0e23\u0e1b\u0e23\u0e31\u0e1a\u0e40\u0e1b\u0e25\u0e35\u0e48\u0e22\u0e19"
  },
  "status": "completed",
  "turns_used": 1,
  "input_tokens": 1373,
  "output_tokens": 1154,
  "raw_summary": "\u0e04\u0e13\u0e30\u0e01\u0e23\u0e23\u0e21\u0e01\u0e32\u0e23\u0e17\u0e33\u0e07\u0e32\u0e19\u0e08\u0e30\u0e1e\u0e34\u0e08\u0e32\u0e23\u0e13\u0e32\u0e1c\u0e25\u0e2a\u0e33\u0e23\u0e27\u0e08\u0e41\u0e25\u0e30\u0e2a\u0e23\u0e49\u0e32\u0e07\u0e2a\u0e21\u0e21\u0e15\u0e34\u0e10\u0e32\u0e19\u0e01\u0e32\u0e23\u0e1b\u0e23\u0e31\u0e1a\u0e1b\u0e23\u0e38\u0e07\u0e17\u0e35\u0e48\u0e2b\u0e25\u0e32\u0e01\u0e2b\u0e25\u0e32\u0e22\u0e43\u0e19\u0e2b\u0e25\u0e32\u0e22\u0e41\u0e01\u0e19 \u0e14\u0e31\u0e07\u0e19\u0e35\u0e49\n\n1. **\u0e04\u0e27\u0e32\u0e21\u0e1b\u0e25\u0e2d\u0e14\u0e20\u0e31\u0e22 (Security)**:\n   - \u0e43\u0e19\u0e02\u0e13\u0e30\u0e19\u0e35\u0e49\u0e2a\u0e48\u0e27\u0e19\u0e43\u0e2b\u0e0d\u0e48\u0e21\u0e35\u0e2d\u0e22\u0e39\u0e48\u0e41\u0e25\u0e49\u0e27 \u0e41\u0e25\u0e30\u0e44\u0e14\u0e49\u0e23\u0e31\u0e1a\u0e01\u0e32\u0e23\u0e15\u0e23\u0e27\u0e08\u0e2a\u0e2d\u0e1a\u0e41\u0e25\u0e49\u0e27\u0e08\u0e32\u0e01\u0e04\u0e23\u0e31\u0e49\u0e07\u0e01\u0e48\u0e2d\u0e19 \u0e2a\u0e21\u0e21\u0e15\u0e34\u0e10\u0e32\u0e19\u0e08\u0e30\u0e40\u0e19\u0e49\u0e19\u0e44\u0e1b\u0e17\u0e35\u0e48\u0e2a\u0e48\u0e27\u0e19\u0e1c\u0e48\u0e32\u0e19\u0e21\u0e32\u0e2d\u0e37\u0e48\u0e19\u0e46 \n\n2. **\u0e1b\u0e23\u0e30\u0e2a\u0e34\u0e17\u0e18\u0e34\u0e20\u0e32\u0e1e (Performance)**: \n   - \u0e08\u0e32\u0e01\u0e1c\u0e25\u0e2a\u0e33\u0e23\u0e27\u0e08\u0e1e\u0e1a\u0e27\u0e48\u0e32 `fibonacci()` function \u0e43\u0e19\u0e44\u0e1f\u0e25\u0e4c math_utils.py \u0e21\u0e35\u0e01\u0e32\u0e23\u0e43\u0e0a\u0e49\u0e07\u0e32\u0e19 recursion \u0e0b\u0e36\u0e48\u0e07\u0e17\u0e33\u0e43\u0e2b\u0e49\u0e2d\u0e31\u0e15\u0e23\u0e32\u0e04\u0e37\u0e19\u0e02\u0e2d\u0e07\u0e40\u0e27\u0e25\u0e32\u0e41\u0e25\u0e30\u0e1b\u0e23\u0e34\u0e21\u0e32\u0e13\u0e02\u0e49\u0e2d\u0e21\u0e39\u0e25\u0e2a\u0e39\u0e07 \u0e40\u0e19\u0e37\u0e48\u0e2d\u0e07\u0e08\u0e32\u0e01\u0e04\u0e27\u0e32\u0e21\u0e44\u0e21\u0e48\u0e08\u0e33\u0e40\u0e1b\u0e47\u0e19\u0e43\u0e19\u0e01\u0e32\u0e23\u0e15\u0e23\u0e27\u0e08\u0e2a\u0e2d\u0e1a\u0e2a\u0e48\u0e27\u0e19\u0e17\u0e35\u0e48\u0e21\u0e35\u0e2d\u0e22\u0e39\u0e48\u0e41\u0e25\u0e49\u0e27 \u0e08\u0e36\u0e07\u0e44\u0e21\u0e48\u0e1e\u0e34\u0e08\u0e32\u0e23\u0e13\u0e32\u0e2a\u0e21\u0e21\u0e15\u0e34\u0e10\u0e32\u0e19\u0e43\u0e19\u0e41\u0e01\u0e19\u0e19\u0e35\u0e49\n\n3. **\u0e2a\u0e16\u0e32\u0e1b\u0e31\u0e15\u0e22\u0e01\u0e23\u0e23\u0e21 (Architecture)**:\n   - \u0e43\u0e19\u0e02\u0e13\u0e30\u0e19\u0e35\u0e49\u0e22\u0e31\u0e07\u0e44\u0e14\u0e49\u0e23\u0e31\u0e1a\u0e01\u0e32\u0e23\u0e15\u0e23\u0e27\u0e08\u0e2a\u0e2d\u0e1a\u0e19\u0e49\u0e2d\u0e22\u0e21\u0e32\u0e01 \u0e40\u0e25\u0e37\u0e2d\u0e01\u0e2a\u0e23\u0e49\u0e32\u0e07\u0e2a\u0e21\u0e21\u0e15\u0e34\u0e10\u0e32\u0e19\u0e17\u0e35\u0e48\u0e2a\u0e32\u0e21\u0e32\u0e23\u0e16\u0e40\u0e1e\u0e34\u0e48\u0e21\u0e04\u0e27\u0e32\u0e21\u0e40\u0e02\u0e49\u0e32\u0e43\u0e08\u0e43\u0e19\u0e42\u0e04\u0e23\u0e07\u0e2a\u0e23\u0e49\u0e32\u0e07\u0e02\u0e2d\u0e07\u0e23\u0e30\u0e1a\u0e1a\u0e41\u0e25\u0e30\u0e04\u0e27\u0e32\u0e21\u0e23\u0e48\u0e27\u0e21\u0e23\u0e30\u0e2b\u0e27\u0e48\u0e32\u0e07\u0e2d\u0e47\u0e2d\u0e1a\u0e40\u0e08\u0e04 \u0e14\u0e49\u0e27\u0e22\u0e01\u0e32\u0e23\u0e17\u0e33\u0e43\u0e2b\u0e49\u0e2d\u0e47\u0e2d\u0e1a\u0e40\u0e08\u0e04\u0e2b\u0e23\u0e37\u0e2d\u0e42\u0e21\u0e14\u0e39\u0e25\u0e41\u0e22\u0e01\u0e15\u0e32\u0e21\u0e04\u0e27\u0e32\u0e21\u0e2a\u0e19\u0e43\u0e08 \u0e23\u0e27\u0e21\u0e16\u0e36\u0e07\u0e25\u0e14\u0e01\u0e32\u0e23\u0e04\u0e25\u0e49\u0e2d\u0e07 (coupling) \u0e43\u0e19\u0e2a\u0e48\u0e27\u0e19\u0e15\u0e48\u0e32\u0e07 \u0e46\n\n4. **\u0e17\u0e14\u0e2a\u0e2d\u0e1a\u0e04\u0e27\u0e32\u0e21\u0e04\u0e23\u0e2d\u0e1a\u0e04\u0e25\u0e38\u0e21 (Test Coverage)**: \n   - \u0e08\u0e32\u0e01\u0e1c\u0e25\u0e2a\u0e33\u0e23\u0e27\u0e08\u0e41\u0e25\u0e30\u0e23\u0e2d\u0e1a\u0e01\u0e48\u0e2d\u0e19\u0e2b\u0e19\u0e49\u0e32\u0e22\u0e31\u0e07\u0e21\u0e35\u0e2a\u0e21\u0e21\u0e15\u0e34\u0e10\u0e32\u0e19\u0e40\u0e1b\u0e47\u0e19\u0e40\u0e23\u0e37\u0e48\u0e2d\u0e07\u0e41\u0e25\u0e49\u0e27 \u0e01\u0e32\u0e23\u0e2a\u0e23\u0e49\u0e32\u0e07\u0e2a\u0e21\u0e21\u0e15\u0e34\u0e10\u0e32\u0e19\u0e17\u0e35\u0e48\u0e19\u0e35\u0e48\u0e2d\u0e32\u0e08\u0e44\u0e21\u0e48\u0e21\u0e35\u0e17\u0e32\u0e07\u0e08\u0e30\u0e17\u0e33\u0e43\u0e2b\u0e49\u0e40\u0e01\u0e34\u0e14\u0e42\u0e2d\u0e01\u0e32\u0e2a\u0e1e\u0e31\u0e12\u0e19\u0e32\u0e17\u0e35\u0e48\u0e43\u0e2b\u0e21\u0e48 \u0e46 \n\n5. **\u0e1b\u0e23\u0e30\u0e2a\u0e1a\u0e01\u0e32\u0e23\u0e13\u0e4c\u0e1c\u0e39\u0e49\u0e43\u0e0a\u0e49 (UX/Cli)**:\n   - \u0e08\u0e32\u0e01\u0e01\u0e32\u0e23\u0e2a\u0e33\u0e23\u0e27\u0e08\u0e1e\u0e1a\u0e27\u0e48\u0e32\u0e22\u0e31\u0e07\u0e44\u0e21\u0e48\u0e44\u0e14\u0e49\u0e21\u0e35\u0e01\u0e32\u0e23\u0e17\u0e33\u0e44\u0e27\u0e49\u0e27\u0e48\u0e32\u0e21\u0e35\u0e1b\u0e31\u0e0d\u0e2b\u0e32\u0e2b\u0e23\u0e37\u0e2d\u0e02\u0e49\u0e2d\u0e21\u0e39\u0e25\u0e17\u0e35\u0e48\u0e19\u0e31\u0e01\u0e1e\u0e31\u0e12\u0e19\u0e32\u0e15\u0e49\u0e2d\u0e07\u0e23\u0e31\u0e1a\u0e23\u0e39\u0e49\u0e2d\u0e22\u0e39\u0e48\u0e1a\u0e49\u0e32\u0e07 \u0e22\u0e01\u0e15\u0e31\u0e27\u0e2d\u0e22\u0e48\u0e32\u0e07\u0e40\u0e0a\u0e48\u0e19 \u0e01\u0e32\u0e23\u0e40\u0e1e\u0e34\u0e48\u0e21\u0e02\u0e49\u0e2d\u0e04\u0e27\u0e32\u0e21\u0e0a\u0e48\u0e27\u0e22\u0e40\u0e2b\u0e25\u0e37\u0e2d\u0e17\u0e35\u0e48\u0e2a\u0e33\u0e04\u0e31\u0e0d\u0e2b\u0e23\u0e37\u0e2d\u0e1b\u0e23\u0e31\u0e1a\u0e1b\u0e23\u0e38\u0e07\u0e04\u0e33\u0e2a\u0e31\u0e48\u0e07\u0e41\u0e25\u0e30\u0e02\u0e49\u0e2d\u0e1c\u0e34\u0e14\u0e1e\u0e25\u0e32\u0e14\n\n6. **\u0e01\u0e32\u0e23\u0e27\u0e34\u0e28\u0e27\u0e01\u0e23\u0e23\u0e21\u0e01\u0e32\u0e23\u0e40\u0e23\u0e35\u0e22\u0e01 (Prompt Engineering)**:\n   - \u0e40\u0e19\u0e37\u0e48\u0e2d\u0e07\u0e08\u0e32\u0e01\u0e44\u0e21\u0e48\u0e21\u0e35\u0e2a\u0e21\u0e21\u0e15\u0e34\u0e10\u0e32\u0e19\u0e17\u0e35\u0e48\u0e40\u0e01\u0e35\u0e48\u0e22\u0e27\u0e02\u0e49\u0e2d\u0e07\u0e21\u0e32\u0e01\u0e48\u0e2d\u0e19 \u0e2a\u0e48\u0e27\u0e19\u0e19\u0e35\u0e49\u0e2d\u0e32\u0e08\u0e08\u0e30\u0e40\u0e1b\u0e47\u0e19\u0e42\u0e2d\u0e01\u0e32\u0e2a\u0e17\u0e35\u0e48\u0e14\u0e35\u0e43\u0e19\u0e01\u0e32\u0e23\u0e2a\u0e33\u0e23\u0e27\u0e08\u0e04\u0e27\u0e32\u0e21\u0e0a\u0e31\u0e14\u0e40\u0e08\u0e19\u0e02\u0e2d\u0e07 prompts \u0e41\u0e25\u0e30\u0e23\u0e32\u0e22\u0e25\u0e30\u0e40\u0e2d\u0e35\u0e22\u0e14\u0e40\u0e04\u0e23\u0e37\u0e48\u0e2d\u0e07\u0e21\u0e37\u0e2d \u0e01\u0e32\u0e23\u0e28\u0e36\u0e01\u0e29\u0e32\u0e17\u0e32\u0e07\u0e20\u0e31\u0e22\u0e41\u0e25\u0e30\u0e2a\u0e23\u0e49\u0e32\u0e07\u0e2a\u0e48\u0e27\u0e19\u0e19\u0e35\u0e49\u0e08\u0e30\u0e2a\u0e32\u0e21\u0e32\u0e23\u0e16\u0e1b\u0e23\u0e31\u0e1a\u0e1b\u0e23\u0e38\u0e07\u0e1b\u0e23\u0e30\u0e2a\u0e34\u0e17\u0e18\u0e34\u0e20\u0e32\u0e1e\u0e01\u0e32\u0e23\u0e40\u0e02\u0e49\u0e32\u0e43\u0e08\u0e41\u0e25\u0e30\u0e01\u0e32\u0e23\u0e43\u0e0a\u0e49\u0e07\u0e32\u0e19\n\n7. **\u0e20\u0e32\u0e1e\u0e23\u0e27\u0e21\u0e01\u0e32\u0e23\u0e17\u0e33\u0e07\u0e32\u0e19 (Observability)**:\n   - \u0e43\u0e19\u0e02\u0e13\u0e30\u0e19\u0e35\u0e49\u0e22\u0e31\u0e07\u0e44\u0e21\u0e48\u0e21\u0e35\u0e2a\u0e21\u0e21\u0e15\u0e34\u0e10\u0e32\u0e19\u0e2b\u0e23\u0e37\u0e2d\u0e15\u0e23\u0e27\u0e08\u0e2a\u0e2d\u0e1a\u0e2a\u0e48\u0e27\u0e19\u0e19\u0e35\u0e49\u0e40\u0e17\u0e48\u0e32\u0e19\u0e31\u0e49\u0e19 \u0e01\u0e32\u0e23\u0e40\u0e1e\u0e34\u0e48\u0e21\u0e23\u0e30\u0e1a\u0e1a\u0e04\u0e27\u0e32\u0e21\u0e40\u0e2b\u0e47\u0e19\u0e08\u0e36\u0e07\u0e2d\u0e32\u0e08\u0e0a\u0e48\u0e27\u0e22\u0e43\u0e2b\u0e49\u0e19\u0e31\u0e01\u0e1e\u0e31\u0e12\u0e19\u0e32\u0e2a\u0e32\u0e21\u0e32\u0e23\u0e16\u0e40\u0e02\u0e49\u0e32\u0e43\u0e08\u0e01\u0e32\u0e23\u0e14\u0e33\u0e40\u0e19\u0e34\u0e19\u0e07\u0e32\u0e19\u0e17\u0e35\u0e48\u0e41\u0e17\u0e49\u0e08\u0e23\u0e34\u0e07\u0e44\u0e14\u0e49\u0e2d\u0e22\u0e48\u0e32\u0e07\u0e23\u0e27\u0e14\u0e40\u0e23\u0e47\u0e27\u0e41\u0e25\u0e30\u0e07\u0e48\u0e32\u0e22\u0e14\u0e32\u0e22\n\n\u0e14\u0e31\u0e07\u0e19\u0e31\u0e49\u0e19 \u0e2a\u0e33\u0e2b\u0e23\u0e31\u0e1a\u0e23\u0e39\u0e1b\u0e41\u0e1a\u0e1a\u0e2a\u0e21\u0e21\u0e38\u0e15\u0e10\u0e32\u0e19\u0e17\u0e35\u0e48\u0e08\u0e30\u0e2a\u0e23\u0e49\u0e32\u0e07\u0e02\u0e36\u0e49\u0e19 \u0e40\u0e23\u0e32\u0e2d\u0e32\u0e08\u0e40\u0e25\u0e37\u0e2d\u0e01 \"UX/Cli\" \u0e41\u0e25\u0e30 \"Prompt Engineering\"\n\n```json\n{\n  \"hypotheses\": [\n    {\n      \"id\": \"H1\",\n      \"title\": \"\u0e1b\u0e23\u0e31\u0e1a\u0e1b\u0e23\u0e38\u0e07\u0e04\u0e27\u0e32\u0e21\u0e0a\u0e31\u0e14\u0e40\u0e08\u0e19\u0e22\u0e01\u0e23\u0e30\u0e14\u0e31\u0e1a\u0e41\u0e25\u0e30\u0e40\u0e1e\u0e34\u0e48\u0e21\u0e01\u0e32\u0e23\u0e41\u0e08\u0e49\u0e07\u0e40\u0e15\u0e37\u0e2d\u0e19\u0e1c\u0e39\u0e49\u0e43\u0e0a\u0e49\u0e43\u0e19 'agent.py' and 'cli.py'\",\n      \"axis\": \"ux_cli\",\n      \"description\": \"\u0e40\u0e1e\u0e34\u0e48\u0e21\u0e23\u0e32\u0e22\u0e25\u0e30\u0e40\u0e2d\u0e35\u0e22\u0e14\u0e02\u0e49\u0e2d\u0e04\u0e27\u0e32\u0e21\u0e2a\u0e33\u0e2b\u0e23\u0e31\u0e1a\u0e04\u0e33\u0e2a\u0e31\u0e48\u0e07\u0e17\u0e35\u0e48\u0e2a\u0e33\u0e04\u0e31\u0e0d \u0e41\u0e25\u0e30\u0e1b\u0e23\u0e31\u0e1a\u0e1b\u0e23\u0e38\u0e07\u0e02\u0e49\u0e2d\u0e21\u0e39\u0e25\u0e17\u0e32\u0e07\u0e40\u0e17\u0e04\u0e19\u0e34\u0e04\u0e43\u0e2b\u0e49\u0e1e\u0e23\u0e49\u0e2d\u0e21\u0e21\u0e32\u0e01\u0e02\u0e36\u0e49\u0e19 \u0e2a\u0e23\u0e49\u0e32\u0e07\u0e23\u0e32\u0e22\u0e25\u0e30\u0e40\u0e2d\u0e35\u0e22\u0e14\u0e02\u0e49\u0e2d\u0e1c\u0e34\u0e14\u0e1e\u0e25\u0e32\u0e14\u0e17\u0e35\u0e48\u0e0a\u0e31\u0e14\u0e40\u0e08\u0e19\u0e41\u0e25\u0e30\u0e40\u0e02\u0e49\u0e32\u0e43\u0e08\u0e44\u0e14\u0e49\u0e07\u0e48\u0e32\u0e22\",\n      \"files_to_change\": [\"agent.py\", \"cli.py\"],\n      \"estimated_value\": 9,\n      \"estimated_risk\": 2,\n      \"net_score\": 7\n    },\n    {\n      \"id\": \"H2\",\n      \"title\": \"\u0e1b\u0e23\u0e31\u0e1a\u0e1b\u0e23\u0e38\u0e07 prompt_engineering \u0e0b\u0e36\u0e48\u0e07\u0e2a\u0e32\u0e21\u0e32\u0e23\u0e16\u0e40\u0e1e\u0e34\u0e48\u0e21\u0e04\u0e27\u0e32\u0e21\u0e40\u0e02\u0e49\u0e32\u0e43\u0e08\u0e23\u0e30\u0e1a\u0e1a\u0e41\u0e25\u0e30\u0e1b\u0e23\u0e30\u0e2a\u0e1a\u0e01\u0e32\u0e23\u0e13\u0e4c\u0e43\u0e0a\u0e49\u0e07\u0e32\u0e19\u0e02\u0e2d\u0e07\u0e1c\u0e39\u0e49\u0e43\u0e0a\u0e49\u0e43\u0e19 'prompts.py'\",\n      \"axis\": \"prompt_engineering\",\n      \"description\": \"\u0e1b\u0e23\u0e31\u0e1a\u0e1b\u0e23\u0e38\u0e07 prompts \u0e40\u0e1e\u0e37\u0e48\u0e2d\u0e0a\u0e48\u0e27\u0e22\u0e40\u0e23\u0e35\u0e22\u0e01\u0e27\u0e48\u0e32\u0e40\u0e1b\u0e47\u0e19\u0e44\u0e1b\u0e2d\u0e22\u0e48\u0e32\u0e07\u0e16\u0e39\u0e01\u0e15\u0e49\u0e2d\u0e07 \u0e2a\u0e23\u0e49\u0e32\u0e07\u0e23\u0e32\u0e22\u0e25\u0e30\u0e40\u0e2d\u0e35\u0e22\u0e14\u0e17\u0e35\u0e48\u0e08\u0e30\u0e17\u0e33\u0e43\u0e2b\u0e49\u0e19\u0e31\u0e01\u0e1e\u0e31\u0e12\u0e19\u0e32\u0e40\u0e02\u0e49\u0e32\u0e43\u0e08\u0e23\u0e30\u0e1a\u0e1a\u0e41\u0e25\u0e30\u0e27\u0e34\u0e18\u0e35\u0e01\u0e32\u0e23\u0e17\u0e35\u0e48\u0e40\u0e2b\u0e21\u0e32\u0e30\u0e2a\u0e21\u0e43\u0e19\u0e01\u0e32\u0e23\u0e43\u0e0a\u0e49\u0e07\u0e32\u0e19;\",\n      \"files_to_change\": [\"prompts.py\"],\n      \"estimated_value\": 7,\n      \"estimated_risk\": 1,\n      \"net_score\": 6\n    }\n  ],\n  \"selected\": \"H1\",\n  \"rationale\": \"\u0e2a\u0e21\u0e21\u0e15\u0e34\u0e10\u0e32\u0e19 H1 \u0e21\u0e35\u0e04\u0e27\u0e32\u0e21\u0e19\u0e48\u0e32\u0e08\u0e30\u0e40\u0e1b\u0e47\u0e19\u0e2a\u0e39\u0e07\u0e41\u0e25\u0e30\u0e2a\u0e23\u0e49\u0e32\u0e07\u0e04\u0e38\u0e13\u0e04\u0e48\u0e32\u0e17\u0e35\u0e48\u0e2a\u0e33\u0e04\u0e31\u0e0d\u0e21\u0e32\u0e01 \u0e41\u0e25\u0e30\u0e44\u0e21\u0e48\u0e21\u0e35\u0e04\u0e27\u0e32\u0e21\u0e40\u0e2a\u0e35\u0e48\u0e22\u0e07\u0e43\u0e19\u0e01\u0e32\u0e23\u0e1b\u0e23\u0e31\u0e1a\u0e40\u0e1b\u0e25\u0e35\u0e48\u0e22\u0e19\"\n}\n```"
}